name,line
Interviewer,You already be history all right there we go we're out of here all right go that's it sway so before we get started.
Eminem,Will you please sign this damn baby bro craziness our teenage years I didn't know I had bars once once upon a time.
Interviewer,Huh let me say marshall you want me to say yes please okay that's em pay rs80 mmm-hmm and I signed a vinyl for him.
Eminem,Yeah look at that man look at incredible yo yeah man your signatures so much better than mine thanks man yeah no.
Interviewer,Problem man oh man you threw me off with that up your whole not really this.
Eminem,Impressed that you dug that deep in the creeks man I didn't know you I'm always digging the crates uh that's good to.
Interviewer,Know man that's good to know do you want to use any lyrics from any of those songs on that vinyl but I doubt what I.
Eminem,Was gonna ask you where where cameras are off there's a couple bars and I wish I could have yeah that's cool man go.
Interviewer,Ahead man what's mine is yours man if it make your tighter you know to speak on Barstow and we are kamikaze came out you.
Eminem, know you shocked the world the way you did it what made you do it I mean a revival came out December 2017 I wasn't.
Interviewer, there long ago it's less than a year what made you just drop it on the world the way you did because I feel like I.
Eminem, feel like the way the climate is right now if you give people if you give people enough time to I got an I'm.
Interviewer, coming out in two months you give people time to say man you better have a song like this all right with it if.
Eminem, you don't have a song like this I ain't with it yeah he better not be rapping like this he better not be.
Interviewer,Rapping about this or i'm not gonna with it and when you go into an album you're going to anything with the.
Eminem,Mindset of this is gonna suck and then even if even if you kind of don't feel that way you're already kind of formed.
Interviewer,Your opinion in front of all your friends and you know I'm saying late so I feel like I feel like giving them.
Eminem,No warning was the best thing to do just because it doesn't give people enough time to you know when the revival.
Interviewer,Tractors came down the pipe yeah i remember that it was like overwhelmingly this is gonna be trash yeah.
Eminem,And that was me nobody really wanted to be wrong about it yeah they had already formed I'm not saying everybody but a.
Interviewer,Lot of people had already you know form their opinions so yeah that was interesting like revival really got ran.
Eminem,Through the wringer so to speak before it even got off the ground but you know it this is that day and age you know oh.
Interviewer,Yeah you know how but you just it to that like before which is what I find interesting about you before you spent.
Eminem,Your whole career being critiqued and criticized by organizations like LGBTQ community or college campuses or police.
Interviewer,Departments you know but hip-hop always stood by you so that was you know that's what you found your refuge but now it.
Eminem,Came from inside of hip-hop you know how did that affect you me sitting back and seeing things that I saw it was kind of.
Interviewer,Like i felt like i felt a bunch of different ways I felt like okay maybe because it doesn't sound like everything.
Eminem,Else in there in and what what most people are doing mm-hmm maybe that was what tainted their here because I.
Interviewer,Remember a time in hip-hop where you had to be so different from the next person or you were trash there's a shift.
Eminem,Somewhere that happened that if it doesn't sound like everything else then it's trash automatically yeah and I just.
Interviewer,Said back like okay all right i can take that it's not like I can't take constructive criticism but I feel like.
Eminem,It kind of went beyond constructive criticism so I had to go back to it and look.
Interviewer,I have made albums that definitely probably would not be my the top of my list.
Eminem,Mm-hmm what encore okay relapse which i believe encores are better album and relapse relapse is something that I.
Interviewer,Looked at a couple of years went back to and cringed at oh Jesus Christ I even realized I was doing that many accidents.
Eminem,I don't i just studied for whatever reason I just got into it and was just like started on this weird serial killer.
Interviewer,Vibe kind of thing and started wanting to talk crazy and start bending words more than only way you could bend them.
Eminem,Bend them is with this accent trying to use this one like and a couple years later I you know in making recovery and.
Interviewer,Slipping out of that getting out of the accents and Beyond it made recovery yeah and I always say that if it wasn't for.
Eminem,Relapse i wouldn't have been able to make recovery and if it wasn't with if it wasn't for revival.
Interviewer,I wouldn't been able to make this out so I'm good with it it just you know some people more than others went a little.
Eminem,Weird little far with it a little far what I want to get into that too and I almost you know when I listen to.
Interviewer,Kamikaze and i hear some people say man that's the vintage em we want it you know we want it shady back right and.
Eminem,When i listen to it man i have to admit man I hear something in you on this album that kind of made me rejoice.
Interviewer,Anyway i've done in the past i like the fact that you're not running from the criticism I like the fact that in this.
Eminem,Digital age you're not you know cowering and in reforming to what people think you should sound like how people think.
Interviewer,You should act and you're calling it out and I actually like some of these review shows that you see on YouTube and they.
Eminem,Take people's music and they have fun with it I look at these kids and I and I see us when we were young myself when I.
Interviewer,Was younger i've seen you too but we'll go to a G Rap Album and oh this was dope that was dope farside album this was.
Eminem,Dope yeah they just kind of doing that right and you dress them so you're that in tuned like.
Interviewer,In the beginning a ring ring when you talk about if you could teach fatigue me you know you can make millions if I.
Eminem,Could teach you there's nothing i would be yeah it gets into the territory where it's like it's like you got okay so.
Interviewer,Since the internet has become what the Internet's be coming here since YouTube and all that you've got so many how can.
Eminem,I say this it's it's almost like not enough Indians too many chiefs so it's like somebody everybody on the internet.
Interviewer,And in hip-hop especially is it seemed like either a rapper DJ a writer producer does something has something to.
Eminem,Do with it and it's in and i love the fact I love the fact that so many people now have been able to get on easier than.
Interviewer,It was for me or you back in the day cuz we didn't have that we didn't have this platform so I appreciate the platform.
Eminem,It's just that now you've got now you've got people that not only are doing the same thing and they can do it better but.
Interviewer,You've got people who don't do anything and are just critiquing it so I sat back and I'm like okay that's fine people can.
Eminem,Talk crazy about me that's fine they should they should express themselves and they have a right to but I also get.
Interviewer,To say whatever the i want about you know mmm I'm like I said I'm good with revival it.
Eminem,Mm-hmm because i couldn't have made this album without that yeah and there is something I'm not gonna lie there is.
Interviewer,Something inside me that is a little more happy when I'm angry it's like as much as I as bad as it feels you know to.
Eminem,Be there there's also something about it there's a rush of it that I like because it inspires me to say something back.
Interviewer,You getting that weird area to where it's like oh it's just he doesn't care about what anybody thinks about him but.
Eminem,Now he cares about what everybody thinks about him no he's just saying he don't care he'll.
Interviewer,Say anything he wants about you if you say about him because he doesn't care like there's so many different levels to.
Eminem,Not caring about you know i'm saying but it was interesting it was definitely interesting because I'm like.
Interviewer,How off his mic here yeah jesus Christ like and then and then it was interesting to watch the reaction of the.
Eminem,Chloraseptic remix verse that i did you know with 2 Chainz and get out in January you kind of you touched on you.
Interviewer,Guys form to opinion just from a track that's where I was at yeah at that point in time that is definitely where I was.
Eminem,At but i watch people going oh why wasn't this only viable honestly I probably what if I said it was on.
Interviewer,Revival you won't know because you didn't listen probably yeah but I kind of felt like okay I guess this is what.
Eminem,People might want cuz i'm always stuck in that what the do people want like like you were saying that the OM is.
Interviewer,Back and he's too old to be dough and he can't do like no matter what when Isaac I should have zagged no matter what you.
Eminem,Got half and half every single time you kind of say that you allude to it and one of the songs well you said.
Interviewer,You set the bar so high that you know at this point you know everything is considered a failure like you almost.
Eminem,Competing with yourself that you touch on it a lot in every song well not every song but majority of songs you touch on.
Interviewer,It i appreciate but i have to like the Joe Button thing is it's a really interesting because that along with MGK.
Eminem,Of course it's making a lot of noise out there and it throws a lot of folks off when Joe first started commenting it was.
Interviewer,Mixed reaction some people said it was disloyal some people said man he's entitled to his opinion well I would.
Eminem,Assume that obviously it got under your skin considering relationship you've had with him with slaughterhouse.
Interviewer,Yes how do you how did how do you describe your relationship with Joe but how do you describe.
Eminem,Shop with joe button i mean listen me and Joe button aren't you know we're not friends like that we're not like we.
Interviewer,Didn't go to the same high school or something I'm saying so I get that part but when I'm out here flying.
Eminem,Around to different places and doing interviews and trying to use my platform to pump up slaughterhouse every chance I.
Interviewer,Get and you're using your platform to trash me and I'm one of the things that keeps this ship moving do you know I'm saying so you're doing.
Eminem, something you've got a voice in hip-hop so you actually could be affecting this ship a little bit you know saying.
Interviewer, because you don't owe me nothing but I've never gotten a interview and been like Joe Budden is.
Eminem, trash that last album he put out is trash so that's that's kind of the attitude I took to this whole album.
Interviewer,Kamikaze is like alright what if i give everybody my opinion about them but I want to talk about slaughterhouse.
Eminem,Because there's a lot of including myself people that really feel like this slaughterhouse saga was unfinished you.
Interviewer,Know i know there's a glass house album that was pretty much completed but never release right.
Eminem,Where we had left it about two years ago was everybody came in and different some of some of the guys in the group picked.
Interviewer,Certain beats so many guys didn't feel those beats are they like the other beats and there was like there was.
Eminem,Definitely enough songs to put an album out but for the most part it wasn't a complete picture because everybody.
Interviewer,Wasn't on the same page of what their favorite songs were so I thought they were gonna go back go back home regroup.
Eminem,And try to make a few more songs i didn't hear anything from that and then at that point I started getting really.
Interviewer,Deep into revival you know i was recording every day so a couple months go by and from what I understand it to.
Eminem,Be what i was told I didn't hear this firsthand like Joe said slaughterhouse ain't hot right now.
Interviewer,We don't have a buzz we need to put out next table from that point everybody started branching out Royce went and did.
Eminem,His album crime like everybody started doing their own kind of song oh so I thought they were just happy with.
Interviewer,That you know i'm saying like they just wanted to maybe work on their own projects for a while and we would come.
Eminem,Back and visit this or whatever when we made the first other house album the welcome to our welcome to our house that.
Interviewer,Was another album that i felt like holy people who literally just trashed this they trashed this out and there was a huge backlash of oh man you.
Eminem, say what we want to hear it sounds too polished and elicits like you're not listen you're critiquing these guys who.
Interviewer, are wordsmiths jr. I'm saying like so you're there's look there's a certain type of person that man I like I.
Eminem, only like two beats a certain type of person that would lean towards lyrics mortars certain type of person that was.
Interviewer, leaning towards a voice more they like better you know I'm saying like everybody leans towards towards their.
Eminem, own thing but I was just like holy cuz to me the beats were crazy on that album and only thing I did was added my.
Interviewer, little touch of like sprinkle in music in these tracks and mixing them to try to bring out you know the production a.
Eminem, little bit which I don't even know if I did any actual beats on there on the first album but but all I heard was the.
Interviewer, backlash that it was too polished yeah so we said okay let's do another album and then you guys do what you want to do.
Eminem, with it which is kind of we left the ball in their Court kind of thing so I didn't want to touch.
Interviewer, it in a sense of like other than give my opinions on songs I didn't want to touch it I didn't with my production because I.
Eminem, felt like if what if that is the reason yeah that they didn't sell albums I don't want to hinder that you know.
Interviewer, saying so we gave him another album and next thing I know I hear Joe talking about who got that money who got what.
Eminem, money mm-hmm like he did say I saw a clip that he put up interview with him a crooked.
Interviewer, that he felt like that maybe perhaps like he alluded there you and Paul got joy the money there but but the album I.
Eminem, hate to say this because I think the guys are super talented but the album didn't do much to even recoup the.
Interviewer, first budget then we spent hundreds of thousands of dollars on the second album that never came out what money.
Eminem, didn't you get I don't know if I made a dime off slaughterhouse I don't care if I made nothing I believed in.
Interviewer,Them so i you know i wanted them to i wanted them to be huge man I really did I wanted a group that lyrical to.
Eminem,Just must do everything you know i'm saying and it definitely hurt my feelings a lot when the album didn't do.
Interviewer,Good the first album it was just like man like when we got ceiling on the hook of the my life song I was like yo this is this might be out of here what.
Eminem, was the meaning behind the line when you said the last hit you I'm paraphrasing the last hit you got was what your ex.
Interviewer, chicken that was what that was was that that was a tap just a tap it was a tap but he was also saying that his his.
Eminem, alleged domestic abuse things or whatever which I'm not gonna get into butt but I feel like I feel like the.
Interviewer, reason I had to do that is because like I said there's a there's a there's a fine line between saying you know what.
Eminem, this guy's really been cool to me he's helped me out and tried to help out on many occasion so I'm not gonna go in on.
Interviewer, untouchable like that I'm gonna say it ain't for me not crazy about it whatever whatever but to be the worst song you've.
Eminem, ever heard in your life have you listened to your own do you not listen back cuz if that's the worst.
Interviewer, song you've ever heard in your life I don't know yes it's interesting so we'll never see.
Eminem,That glass house album probably as far as you know I don't know III don't have the answer to that I uh I I want to just.
Interviewer,Make it clear though that aside from the drill I think that slaughterhouse is one of the best rap groups ever to.
Eminem,Ever happen but that being said i i wish their first album would have connected yeah two more people that I did I don't.
Interviewer,To this day i still don't mean paul it was like haha what the happened you know I'm saying like but look man.
Eminem,Everybody's not gonna like everything you put out all the time so that was a dream team of emcees though and I think.
Interviewer,A lot to what you're saying in regards to why aren't people reacting to these words Smith is that's how we came up you.
Eminem,Know and honestly what people may not realize is that's what really separated hip-hop from R&B rock and roll and other.
Interviewer,Genres was our ability to bend words to create patterns I made it unique to our genre specifically which it seems like.
Eminem,It's something that doesn't get any credibility or people don't put a hole not everybody put a whole lot into that.
Interviewer,Now they don't give a lot of credence to that you know which is probably slaughterhouse could have been a victim.
Eminem,Of that that kind of ideology you also in this album you went in on MGK you guys had a discrepancy he mentioned it.
Interviewer,In his response song rap devil you know that let's call sway and ask him why I can't.
Eminem,Get on shade four or five that was in response so I've seen him on the street once and I didn't know he couldn't come.
Interviewer,Up to shade at that time four or five and I said man come on up man and then I had to see him again and say hey man I.
Eminem,Don't know what the is yeah but until that gets cleared up there's no way I can have you on there.
Interviewer,Yeah what's the with that what happened whoa the is just for the record the the thing that was going on.
Eminem,And he was saying about my daughter i didn't even know about that and so like literally like a year and a.
Interviewer,Half later I wasn't it just it never hit my radar and then one day you know you'd go down.
Eminem,The wormhole the youtube and whatever right so I see Machine Gun Kelly talks about Eminem's daughter.
Interviewer,Whatever right so the click on it like yo why is he then he starts doing a press run basically about Haley I'm like.
Eminem,What the yo my man better yeah chill right so that's not why I dis them the reason that distant is actually a.
Interviewer,Lot more petty than that okay the reason that our distant is because he got on first he said first at first when he.
Eminem,Said i'm the greatest rapper alive since my favorite rapper ban me from shade 45 or whatever he said right like I'm.
Interviewer,Trying to hinder his career cycle about your career you think I actually think about you you know how many rappers that are are better.
Eminem, than you you're not even in the conversation I don't care if you blower if you don't blow doesn't matter.
Interviewer, to me but then when you get on tech minds album and you start sending shots and people start hitting me up yo.
Eminem, machine gun just Yui just dissed you reduced you I'm like I listen to it I'm like did he really diss me no I keep.
Interviewer, listening to it y'all just rap you're not gods and then somebody sends me a screenshot of his Twitter and it says.
Eminem, had some to get off my chest you just rapped you not God some like that and I was like a reference for.
Interviewer, the rap god phone yeah so I'm like on the song he said y'all just rap you not gods and on Twitter he said you just rap.
Eminem, you not God had some to get off my chest and I'm seen and by the way this was on the heels of the freestyle here.
Interviewer, just did about shade 45s like shut the up shut the up now now I mean this weird thing because I'm.
Eminem,Like i gotta answer this and every time I do that it makes that person is as irrelevant as.
Interviewer,People say i am em in hip-hop i make them bigger by getting into this thing where i'm like i want to destroy him but.
Eminem,I also don't want to make him bigger do you know what I'm saying because now you're a enemy so I'll leave it.
Interviewer,At that i'm not sure exactly what i'm gonna do at this point right now because I'm still kind of waiting to see what.
Eminem,You haven't heard his rap devil response not heard it what are you thinking it's it's not bad for him.
Interviewer,Mm-hmm he has some good lines in it did John really call Interscope to try to shell this no I I had never made a cop.
Eminem, we made a call to Diddy really I got did his number just hit him up yo did he went up never happened it.
Interviewer, didn't feel like a distant me it just felt like pitiful mmm oh my god now I'm feeling bad for so I might even have.
Eminem, to do with so that's how that happened so he made it reply to my reply so regardless of what the he wants to.
Interviewer, say who was from six years ago shut the up shut the up wait I'm telling you.
Eminem,The reason that dis do now yeah i'm telling you and I'm gonna sit back and I'm gonna wait for a second just to see.
Interviewer,It because if people start firing off and not trying to answer every body that I diss them kamikaze or had.
Eminem,Words about i'm gonna be going the next five years make it this song after dis song you know I'm saying so.
Interviewer,Yeah like you're gonna get hit though Jesse Reyes is featured on this project mm-hmm young up-and-coming star she's on.
Eminem,Two songs how did you find jesse reyes i was coming home I got home one night from a video shoot actually and she was.
Interviewer,On tv was a seth meyers show mm-hmm and she was doing that song gatekeeper that was like.
Eminem,Is this cuz her voice to me was so crazy so I rewound it I was like oh I gotta check her out so I went down the.
Interviewer,Wormhole of looking up and i was like oh I really want to with this chick cuz she right now I'm my personal.
Eminem,Opinion i think she's gonna really blow up mm-hmm that's my personal opinion I've seen people very talented people.
Interviewer,Not do that but i think that i would put my money on her that she will absolutely be huge but I don't even know if like it.
Eminem,Necessarily in the pop world or anything like that I don't feel like she does pop music I feel like she she just cuz she.
Interviewer,Comes from a real place and she writes her own first time I got in a studio with her I played her a couple.
Eminem,Beats and she just started right into one right there laid a hook good guy I was like oh.
Interviewer,So she runs away to a good guy a good guy yeah the one she's singing at the end yeah.
Eminem,There's a nice guy good guy and the reason that that happened is because oddly enough she had already had a song.
Interviewer,Called nice guy she had that song right so I think that was the last day I was in LA I came back.
Eminem,Home and wrote sat at one and then i was like I'm gonna write - the other one - but they're both saying nice guy good.
Interviewer,Guy i was like i'll make it like his kind of one song Dre's all over this project Trey's input was all over it for.
Eminem,Sure he felt like me and him had a couple discussions about the last album and one of the things that he said to me.
Interviewer,Was like he was like he he hit me up on Dave's like yo I don't like how are talking about your album and he had heard revival right.
Eminem, yeah him and Jimmy Iovine has sat in there and listened to most of the songs I had done at Rick Rubin studio and.
Interviewer, based off that reaction I think Dre was a little confused too when that happen probably not more so.
Eminem, than me but but we had a conversation earlier in the year and I think I had only had one song by that time it this.
Interviewer, was like January yeah I had the one song and was thinking about releasing it and then another song got when I got back to.
Eminem, Detroit recorded it like okay now I got two songs I might as well do a album and that's kind of how that came.
Interviewer, about but Drake also there's a couple songs that he kind of dated him just because he didn't have a good reaction.
Eminem, to him and he also felt like one of them's going a little far what does that mean like how far did it go it's it it.
Interviewer, definitely went too far when you say go too far I feel like kamikaze was the place where if you were ever gonna go so.
Eminem, called too far this is where it would be you did the B et verse for the rap cypher and in it you covered a lot of.
Interviewer, content that was relevant to the world we live in today that some folks want to sweep under the rug and this is my own.
Eminem, personal opinion conversations we have every day on che for five months weigh in the morning we talked about you know.
Interviewer, then justice policies prejudice we talked about discrimination all of these different things whether or not we're in.
Eminem, the middle of a race war that is trying to be perpetrated by people in power not a war in a sense where people don't pick.
Interviewer, up guns and shoot it well maybe Brad but in terms of psychologically the whole nine so when you did that verse on.
Eminem, the BT cipher what I thought why it was necessary King crooked had a song called I can't breathe.
Interviewer, where he talks about man we can't just beat only one sameness white rappers shouldn't stay quiet white rappers.
