name,line
Eminem, shouldn't stay quiet I can't tell you how hard that one hit me it was to the point where I'm like this is how strong.
Interviewer, I feel about something I gotta put it in the right words you know and I saw where it was like oh.
Eminem, these are these are not new subjects they're new to M&M and you know that kind of.
Interviewer, how did you respond to that reaction you did you got back last for that you know I got backlash for the Trump cypher and.
Eminem, and yeah you know it is what it is at least at least when this is all said and done maybe I can just be on the.
Interviewer, right side of history but you got people dissecting the bars and going all the is trash it's not even that good.
Eminem,And that's not what it's about you're missing the whole point do you know I'm saying I'm trying to like I'm.
Interviewer,Trying to say this also to my fanbase who might have voted for him a lot of people in my family did and at the time.
Eminem,I did the cypher i realized after it was all said and done that maybe maybe I should have just attacked him when you.
Interviewer,Said a drunk he drew a line and a sane man should have not done that you should have reworded it and showed empathy -.
Eminem,Well that's what i realized after i was done that's kind of how I felt because it's like okay this is this is like this.
Interviewer,Is backfiring on me and i don't care i don't give a if if that's what happened and hurt my sales I don't care.
Eminem,About that yeah i care about the message I'm trying to convey why you felt a need to stand up though what was that for you.
Interviewer,Have marshall what majors because because I was just watching it every single day I watched a lot of news right.
Eminem,Yeah the thing that pissed me off the most that really set me off to when I started going crazy with the pen because.
Interviewer,I'm like the kapernick thing and when that happen and how he kept changing the narrative and kept changing.
Eminem,The narrative you ah i i can't i can't um I'm gonna get into this whole trunk anymore but whoa you mentioned at.
Interviewer,The end of the wringer asian orange sending a secret service to your house that the Secret Service really come to.
Eminem,Your house after that they came to my studio yeah and they asked they had they were just.
Interviewer,Basically asking me questions about my lyrics to see if what the intent was behind him and if I was making a actual.
Eminem,Threat or just expressing myself so so that really happened wow that's crazy right now what we're seeing too cuz.
Interviewer,Colin kapernick was named the face of Nikes 30th anniversary let's do it you saw that right and then you got a whole.
Eminem,Slew of people that are now burning nike shoes and Nike I saw that product it's infuriating yeah when you think yeah.
Interviewer,Like really dude nike supports people who need for the anthem at this point come on seriously seriously you.
Eminem,Got to be a to think that that's just what it's about and it's that cut and dry.
Interviewer,Yeah you know what i'm saying like there's a meaning behind this and there's real pain behind this and.
Eminem,You're burning a pair of shoes when you go about your day and you got your job and you're doing.
Interviewer,Thinking about all this other that's what really bothers you people ain't gonna stop watching.
Eminem,Football they're just not yeah football to me is the best sport there is.
Interviewer,And what draws you to the game should not be if that's how you feel about your country and you feel like you should.
Eminem,Stand for the anthem stand for the anthem that's fine but you also need to realize.
Interviewer,That this is america and people have died for these rights to be able to protest and to be able to take a knee.
Eminem,Stop making it personal about yourself you have nothing to do with this I agree we got to get back to Tyler.
Interviewer,To create a man i'm a i'm a big fan of Tyler's you know and I recently saw him perform I know that Tyler was a big fan.
Eminem,Of yours growing up right and then uh i recall you even reading about you saying some good things about our future are.
Interviewer,They pushing boundaries years ago yeah for sure and you said some great things about them about them as a talent.
Eminem,And pushing boundaries as a group future as a whole yeah what happened what she died you.
Interviewer,Know i really did like him i i thought like I thought their movement was really cool too.
Eminem,Good job make music we didn't make music but you know I just felt like okay there's a mutual expect you respect you.
Interviewer,Know and a lot of this did that ended up happening after that like the Tweety put out with talking about shady.
Eminem,15 and why can't people a little close to him tell him that his sucks and it's trash and like okay listen man you.
Interviewer,Don't have to like it and it could really suck but being that somebody really was cool to you you would expect.
Eminem,Some kind of reciprocation and just don't we go public with it and publicly express your opinion and how much my is trash okay so I talk I chalk it.
Interviewer, up to them being young and just kids you know I'm saying so it was like all right I've been there when I'm saying like I.
Eminem, was dick when I first came out I'm saying like yeah man it worked I don't yeah I feel bad about it I'm.
Interviewer, sorry if I ever was a dick to you but I don't think I ever was was I you know one time man but hey oh yeah yeah that's.
Eminem, true all talk about that okay so I liked them in and then Earl Sweatshirt gets in an interview after after Tyler trashes.
Interviewer, me and then Earl Sweatshirt everybody listens everything's drinking too much Mountain Dew and I'm just like.
Eminem, really like what the like you know I'm saying like you guys were just on tour with us we hung out like we kicked.
Interviewer, it make jokes like you know I'm saying like so the last straw like look I know a lot of this.
Eminem, I could I I could come across being very petty yeah but at a certain point in time someone has their breaking point.
Interviewer, you know I'm saying so when Tyler tweeted out the thing about walk on water this song is.
Eminem, horrible I was like all right I need to say something now because this is.
Interviewer, stupid mm-hmm you know but at the same time I'm not gonna let everybody just keep.
Eminem, I'm not gonna be America's punching bag and just won't think is cool and safe just say whatever the.
Interviewer, they want about me thinking shocks people um because for all your career you was the I just don't give a.
Eminem, that can work both ways how so because you don't give a you will fire back at somebody who says something about you.
Interviewer, I picked and chose who to that I wanted to say my piece with yeah because a lot of those things were personal but then.
Eminem, there's a lot of things that aren't personal and kamikaze you know it's just the game in competition you know.
Interviewer, training spirit of m3 spirit of an MC yeah but um you know with the Tyler the Creator thing and I I realized now and I.
Eminem, realized when I when I when I said it but I wasn't like in the mind frame of I was angry when I said the about.
Interviewer, Tyler the fact of like every time I saw this kid like I'm always so cool you know I'm saying like I I I loved his.
Eminem, energy like everything you know saying like he was a funny dude like he's super charismatic and but I'm sitting.
Interviewer, back like man at what point at what point do I have to say something just to defend myself and.
Eminem, I think that the word that I called him on the album was on that song was one of the things where I felt like this might.
Interviewer, be too far because it might in my the homophobe in my quest yeah in my quest to hurt him I realized that I was.
Eminem, hurting a lot of other people by saying and at the time I was so mad it was just whatever look.
Interviewer, in the midst of everything else that was going on on this album and the things that it took to pull this album together.
Eminem, and all that kind of it was one of the things that I kept going back to going I don't feel right with this.
Interviewer, before the album came out I had the conversation with Paul and we spun the word back.
Eminem, but now I realize people can hear what I'm saying anyways in the case of this man I feel like just man I wish you and.
Interviewer, Tyler could sit down and hash that one out now that to fire Joe shot back and he said what he said because I think.
Eminem, that's a special young man and he could probably use your mentorship and you could probably feed off of what he has.
Interviewer, to offer as well I could tell this different from Joe or some of the other yeah it's definitely different it's not.
Eminem, it's not it is it's not as personal it's one of them things like I do you-you-you you deserve a tap now.
Interviewer, because I think you thought it was cool too just because you slid with the other things and I didn't say because.
Eminem, like I said I was talking it up to them being young and just kids man I'm like but at the same time at what point do I.
Interviewer, just got to switch topics because something I see I keep hearing this reoccurring theme about how important.
Eminem, writing is you know one of my favorite tracks on the album is featuring an up-and-coming star that I think he along.
Interviewer, with others that you mentioned on the album like shine or trigger Jay Cole yeah.
Eminem, joining of Lucas powerful real powerful artist I like y'all together on this track you know I think it's a good mesh.
Interviewer, between a veteran and somebody who's on the rise he's so good - what is it about him that you like the first time my song.
Eminem, was like five years ago with the it wanted to be et Cypress and I peeped how he was like he was saying a lot of lines.
Interviewer, that I saw some of me and that but at the same time I it was different because it was like early on in my career.
Eminem, whenever I get to do a BT cypher I want to try to right til my stands out you know.
Interviewer, I'm saying and he stood out so much to me I was like yo easy which was talking about Miley Cyrus and I'm not mistaken.
Eminem, I'm pretty sure it was something like that but he was talking about pop stars and he was doing this kind of thing but.
Interviewer, I'm like yo people are gonna remember that I remembered it and then I kind of started when he made it the Ross.
Eminem, capiccioni yeah the way he did it from the two perspectives it was genius and it was like stood out wasn't it out so.
Interviewer, much to me like not only that though like the rhymes become listening to the rhondettes.
Eminem, when I'm listening to a rapper I'm listening to what you bringing to the table as far as a skill set right that's.
Interviewer, the first thing I'm a honing on but the fact that like I said like he's not compromising bars to tell his story he.
Eminem, still got complexity in there ya know Sam and he he but he's the water I went like he's taking you on his journey and.
Interviewer, I never snapped out of that journey till he was over you know saying like I was like yo this kid is incredible.
Eminem, y'all got a summer and I'm paraphrasing I can't remember the lyrics exactly but you come in with a verse where you say I.
Interviewer, got a couple of mansions but I still don't have any manners you got a couple of golf writers but to.
Eminem, these kids that don't actually matter what the happened the hip-hop was going on with hip-hop people took that.
Interviewer, line and thought you were indirectly talking about Drake no see here's the thing I saw and I saw that too yeah.
Eminem, Drake is always gonna be in my good graces because he did something for for one of my daughters that I will never.
Interviewer, forget and he will always be in my graces with that and I like Drake what I'm telling you with these lines is I.
Eminem, don't know what's real and what's not it at this point you know I'm saying because you hear.
Interviewer, about this rapper that rap or whatever I'm telling you that I don't do it never have and never will if I ever.
Eminem,Need a ghostwriter I need to just put the mic down you know saying huh so that's my.
Interviewer,Personal belief as far as anybody out here too that does use ghostwriters that's fine.
Eminem,That's if that's what you do that's fine but I'm telling you I don't do it hip-hop was the most important thing.
Interviewer,That empowered me as a kid it made me feel I have a line where I say it made me feel tough when I wasn't yeah when I.
Eminem,Was a scrawny little kid growing up on eight mile walking up the block put headphones on and it made me feel.
Interviewer,Powerful hip-hop probably was I I mean it was it was it was like my dad mmm.
Eminem,Hip-hop you know i'm saying and it was the only thing that made me empowered it made me feel good about myself and when.
Interviewer,I started being able to write rhymes and figured out I could do it that's where the feeling comes from to me because the.
Eminem,Excitement is being able to come up with the you know I'm saying it taught me how to throw my first punch gave me.
Interviewer,The confidence okay be able to throw my first punch and to realize not only that the fact that proof used to beat my ass.
Eminem,All the time in the backyard boxing and one time he beat me like literally to the ground.
Interviewer,What and he was just like em let's just stop cuz I kept getting up coming at him but I'm like but I just kept getting.
Eminem,Beat up he was fast man he's very quick and he's but it made me realize like okay taking a punch is nothing you know.
Interviewer,I'm saying like it's not your fear when you're a kid is like oh my God if I get hit what's it gonna work to hit me in.
Eminem,The nose in it jazz my nose in my brain and I died like kind of you think about but nah man hip-hop hip-hop like.
Interviewer,Since its beginning i was always under the impression that every rapper wrote their rhymes and when you heard about ku.
Eminem,Modi battling busy b mm-hmm it was who's bringing the best rhymes to the table you know saying who's gonna be.
Interviewer,Able to say the best who's the cleverest in the wittiest and then years later fast forward you hear eazy-e.
Eminem,Saying ice cube writes the rhymes that i say mmm-hmm and I remember being a kid like hearing.
Interviewer,The line but it never really i i just didn't really care no you know I'm saying it didn't really affect the way I.
Eminem,Felt about eazy-e or the way i felt about in waa I think in all fairness though I think Drake there's a superior.
Interviewer,Writer to be able to sustain the level of success he has yeah I mean he makes great music there's not really even much.
Eminem,You can say about it you know on this kamikaze album I feel like I was pretty directed whoo yeah I was kind of taking.
Interviewer,Shots at going that and who i wasn't you know saying I wouldn't send subliminals to Drake for there'd be no reason for me.
Eminem,To do that but i am expressing to you that regardless of what any of these other dudes do I have never not even a.
Interviewer,Line not even anything i wouldn't be able to have fun with it if I couldn't write it that makes sense you go in.
Eminem,Really hard about the grammys in a way man you kind of you drag the Grammys in the mud and you talk about you have a.
Interviewer,Few grammys but you feel like you had to sell your soul to get on and you didn't know if you wanted it for the.
Eminem,Recognition or the trophies but it was the difference you know and that Grammys pretty much sucked the blood of artists.
Interviewer,And nominate them have them come to the shows and which they do theirs every year yeah and I got I'm just tired of seeing it and for whatever.
Eminem, reason it's like they're always pitching this hint that you might win album of the year which is a used to be a big.
Interviewer, deal I don't think it's a big deal now you know sat at home this year for the Grammys and watched J and Kendrick not.
Eminem, get it and I felt like one of them should have got it I felt like joining the lucra should.
Interviewer, have won a Grammy for I'm not racist you know absolutely should have won a Grammy every year we we we wit it was I.
Eminem, would be up for album of the year and then the winner is Norah Jones who and I I.
Interviewer, don't I'm not even trying to say anything bad about her music I just at that point I had never heard of her yeah.
Eminem, and none of my friends did either you know I'm saying so we okay whatever and then Steely Dan.
Interviewer, okay I know Steely Dan is you know Steely Dan back in the day you know I'm saying but more than the Marshall.
Eminem, Mathers LP impact like okay fine I watched 50 same 50 did not win best you were new artists at the Grammys.
Interviewer, there was nothing bigger than nothing bigger and nobody nobody since maybe like Snoop came out the gate like that.
Eminem, my first album didn't do it I never saw someone's first album and the wave happened like he had and then he doesn't.
Interviewer, get it and then I get up there another year and what was it the Eminem show and it was like whatever I'm fine if I lose.
Eminem, to Kanye or someone that I'm like okay I respect that I know who that is and Kanye has a huge following and.
Interviewer, he's made a massive impact on music fine I'm good with that but don't get us all here to use.
Eminem, your selling point for your show and stiff everybody every single time and I said after that point in time.
Interviewer, I was like don't ever ask me to come here again please do not ask me my answer is no for a hundred million years.
Eminem, never again will I go to the grave well well now you know I know the Jimmy Jam and and and some of the.
Interviewer, members of the board they are reaching out Just Blaze and different folks are now trying to make it better would you.
Eminem, ever consider you know joining the board and maybe you have a vote in it first of all that vote is fake as that's not.
Interviewer, a real vote that's not a real vote they give it to who they want to give it to they give it to their darlings the.
Eminem, oh this got critical acclaim but it sold two records like it ain't no about always what you sell I get that.
Interviewer,Vanilla ice i understand you know i'm saying like but there comes a point where when an overwhelming something.
Eminem,Comes along that has this wave and impact on music and you give it to a lotta Dottie who lot of Dottie.
Interviewer, something Lottie Dottie but you know what I'm saying like it's like man I don't know who won over Kendrick and J.
Eminem, Bruno Mars is incredible Bruno Mars is great but I remember Beyonce they went for the album lemonade yeah.
Interviewer, yeah it's like what the hell you know it's like they're so tone-deaf to what is actually going on but they're.
Eminem, not in a sense of oh we're gonna give B hunter here we're gonna get J here we're gonna get we can say all these names are.
Interviewer, gonna be here we'll make them play I guarantee you I guarantee you that the people from the Grammys was on the phone.
Eminem, with Beyonce's people or jay-z's people saying every year that they're up for something hinting they're gonna win to.
Interviewer, get them to come there nobody guarantee you over there I guess I won't see you at the Grammys this year yeah.
Eminem, probably not I mean I oh yeah what if you nominated first of all I won't be okay because.
Interviewer, they know that I don't like them and if I was I wouldn't win because they know that I don't like one final question I.
Eminem, want to ask you about a song that to me man it was probably one of the most heart wrenching songs on the project was.
Interviewer, stepping stone you know and it you tell the history of d12 how it started you know and what happened through the.
Eminem, duration and at the end of it you said it's over that's it what of members aware of that song they.
Interviewer, were they were they were they got they got a heads up and you know I explained I honestly I have not talked to Swifton.
Eminem, and conniver yet about the song they just knew it was coming down the pike but uh the way I explained it is this.
Interviewer, proof was the glue they binded us all together right he did so much the scenes that I didn't even realize.
Eminem, and did things to keep us a group and then motivate us mentioned that you guys knew all this stuff was happening but.
Interviewer, y'all never talked about it you know you were man you know I'm paraphrasing in the verses but everybody was doing their.
Eminem, solo projects and you know y'all was drifting further apart well that's what ended up happening was everybody was.
Interviewer, kind of doing their solo things made solar projects mixtapes and things like that and did we're doing shows and I.
Eminem, think the conversation now going forward is to see if there's anything we can do to help their solo careers you know and.
Interviewer, we'll always be friends man we always been friends smooth kids yeah I'm saying so we'll.
Eminem, always be good on that aspect you know and I want to help them do whatever whatever it is that their next thing is.
Interviewer, on the agenda you know I'm saying mixtape album shopping whatever it is when I listen to these stories and I've.
Eminem, known you since the 90s and I've known you through these ups and downs and even if I wasn't there on your side I was.
Interviewer, there on your team so to speak you know I'm sitting there thinking man this man must have went through some great.
Eminem, therapy because right now where you out you seem like you're in a comfortable place you know who you are you know what.
Interviewer, you want and even though you got these people coming at you get strong enough to respond in the way that you wouldn't.
Eminem, naturally do it how did you get to this place though the did you do therapy was it no I just my music is therapy you.
Interviewer, know so I just I don't know man I've been coasting through and I feel like I just always I write all the time.
Eminem, mm-hmm whether I use it or not you know I write all the time and that's my best therapy is to be able to get stuff out.
Interviewer, just like the d12 song it was like one of those things were like I know that they have things they want to say to me.
Eminem, and I have things I want to say to them so this is kind of how I wanted to tell them like you know I love you guys like.
Interviewer, forever they come here it's just the one day g12 album just doesn't seem in this climate right now dear I don't.
Eminem, know how that would even work you don't say yeah yeah you're going through enough with this climate right.
Interviewer, so imagine d12 let me ask you this moving forward this will be my final question you have always to the public.
Eminem, seemed like an elusive introverted person that they don't always have access to the less I think that's.
Interviewer, hilarious okay by the way you know I'm not going to clubs anymore I don't do that.
Eminem, you know saying I'm sober I don't but I do a lot more and go a lot more places than people actually think I do I just.
Interviewer, do it under the radar man that's all we don't you know in Detroit we don't have paparazzi like LA or New York you know.
Eminem, saying so I'm out a lot it's just that people don't really see me don't you out and about.
Interviewer, yeah that's interesting to know like I said you're not gonna catch me in a club throwing money or you know I'm.
Eminem,Saying like i've been through all those days and all that like as far as you know I've done the old club scene.
Interviewer,You know i did it for a long time too long now but congratulations man I like the Kamikaze project thank you um I.
Eminem,Think the majority of folks who listen to it cannot deny that you an elite group of lyricist okay and I'm a dude.
Interviewer,Who's been in this for multiple decades and you at the top of my list and I like to see you keep flying for regardless.
Eminem,Sort of you know whatever the critics have to say they've been craving you back critics since your first album you.
Interviewer,Know so that that's what it's gonna be but I think people and appreciate the fact that you fire back.
Eminem,That you ain't gonna stand for it and that you still are making you still making great music so congratulations.
Interviewer,Brother absolutely thank you mhm and listen I'm glad I could sign that vinyl for you man.
Eminem,Oh yeah you know if you want to i like i said I'm gonna take it home check out some bars okay here let me see that.
Interviewer,Children's silver distance you see that's why in text shout out the King tectus my brother partner in crime since.
Eminem,High school since day one still swaying Tecla forever shave for five months nice make sure you tune in okay shame.
Interviewer,For five demi .
