name,line
Interviewer,this was a hugely significant event the rejoining of the branches of the human species but yea though I would imagine that that makes sense that is the most important event that led by the way Native Americans you know it's famous Infamous problem with metabolizing alcohol okay with Native American you know what else has a problem the Chinese.
Tyson,Badoo yes yes so it's an Asian issue well so who stayed in it so you look at who populated North and South America.
Interviewer,after the year before the land bridge is whoever was right at the edge of Asia then the land bridges are so so so Asians and and North American at the natives of North and South America have more in common with each other because of this then most other pairs or groups you might grab around the world but my point is obviously there's a lot of blank Columbus were but he just happened to be the guy who did it first Europe was coming to the new world no matter what everybody was trying to find it the faster trade route to the Indies and so it would if it was in Columbus would have been Arnold's mednik whatever it doesn't matter somebody did that and the rest is as they say history so personally I think it's the most significant thing to happen in our species otherwise we'd still be to stranded branches of humans.
Tyson,it would be fascinating though like Australia stranded to see what would happen if this is gone on for hundreds of thousands of years that would have been a different story right into your yeah that's a big concern about aliens right one of the big concerns is that there's some sort of a virus that you pick up from somewhere I think that's harder to accept so free Tampa what are the chances that a oak tree would catch whooping cough different species tend to be very species targeted so there's a jump man with a mammal does a vertebrate to vertebrate but so yes that can't happen but the more different the life for MS.
Interviewer,it is sensible to suppose that the less likely you going to share the same diseases that's all but NASA regardless has safeguards in place but in the event that happens so it's it's called the planetary Protection Program Vanessa Scott is a whole division of mask it's protecting Earth from bugs that could be coming from space on our own spaceship that we bring back and it protects destinations from us there's a certain sterilization levels that we invoke the Cassini spacecraft.
Tyson,we plunged that back into Saturn it is death when we were done with it and ran out of money we're done with it plunged into Saturn to vaporize we didn't leave it in orbit around Saturn why cuz it might have crashed into one of Saturn's moons that might have life.
Interviewer,if someone hits sneezed on the spacecraft before it got launched we don't want to contaminate the life that we were later going to one day want to study.
Tyson,that's what we plunged it into Saturday that's why that is why cuz they were worried about that maybe hitting your Ropers like she's dead and you can't track it or guided anymore then it's a it's a while it's a while card am I there other moons that have some ocean water the Water World basically and the concern is that we would introduce life suppose we did it crash and then we go back later and find life and it has DNA just like here but was it our life that we can't aminated with.
Interviewer,you don't want to confuse the future science of it so that's what that's the plan can you even watch a science movie like science fiction movies I know you had a real problem just right here okay let me let me just go on record okay okay.
Tyson,I've been deeply misunderstood with my comments on movies.
Interviewer,deeply misunderstood deeply deeply and so I just stopped was last time you saw a movie comment in my Twitter stream they haven't you haven't I've kind of just wasn't the Matthew McConaughey movie did you comment on that one the one where they at where am I right now then thought I was just being nitpicky it's not fun going to the movies with you why would you did say that can never happen and so so my intent was my intent did not match how people received my intent my intent is here's an observation that I think if you understood this it would enhance your appreciation of the movie Let me Give an example please do Star Wars the Force awakens they've got you at.
Tyson,that's only that introduced bb-8 okay fella cute little fella and in there they have they like the updated Death Star member the old death star has no power to destroy a planet and that's devastating this one.
Interviewer,it can suck energy out of a star so that the star no longer exists then it could take these energy beams and kill six planets at once it's no longer just a one Planet Killer 6 or 8 whatever the number was it was like high single-digits okay well I did the math on this and I tweeted and I I said first okay if you take all the energy from a star.
Tyson,you become a star but maybe they got a containment mechanism I'll give it to them it is the future after all the future but what a long time ago in a galaxy far is another another Another Universe of civilizations okay but they have Lightspeed and we don't so it's the future of our technology even if it's the past of our time who so so you do the calculation and I forgot the number but I got. I calculated how much energy is stored in a star.
Interviewer,that's enough energy to explode a thousand planets oh my gosh under-represented the energy that it sucked out of the house at all out of the start and I thought this could have been more badass than even they came up with in this movie that is the nature of my comments not could this happen could it not happen let me give you a perspective So So 20% of people just get pissed off 80% really like it and they want more but that 20% they they cut me no slack and I'm only doing this for people to enjoy it if I have that level of hate mail I don't need to continue it I've tried to basically stop. I have these thoughts to myself but I don't have the urge to share them I got to teach you the art of post and drop.
Tyson,okay this what you do you post something don't know people going to get mad you drop your phone and you walk away with too many human being I get that but you don't because you still changing your behavior here's my rebuttal rebuttal rebuttal it okay if you're watching a movie that takes place in 1958. Peace and there's a car from 1960 and I'll be crazy and someone who's a pretty good do you complain that the person noticed I know you praise their expertise I get mad at the movie and if you would get mad at the movie if you're watching a Jane Austen. Peace and of 1870 whenever they took place and someone gets out of the carriage.
Interviewer,what tie dye bell bottoms you would cry foul don't take you up I'm exaggerating it obviously had instead of a derby you would cry foul if you were a costume designer and we would all be impressed by that level of knowledge that you exhibited I am bringing a level of science to bear on a movie that is no different from anybody else's expertise who was out there that we have praised for that invocation yet people are not granting me that Latitude to make those comments I don't like what these generalizations I don't like this is what you're saying people are not doing this no a small vocal minority that are assholes and those the people that you're all turn your behavior for that's what I think is ridiculous about that. Because my eyes are you talking about gravity in the fact that hair wouldn't do that in the space stations weren't that close together on.
Tyson,it's assholes my tweets are offerings do not but I'm not I don't want no problems urinating responses that's the problem the only problem is you're reading responses know you do is wonderful 20% freak out is high for me when it's five percent then I take notice how do you say 20% like what are you doing calculations you actually do know a hundred twenty of them that's just run into 20 assholes and so 20 assholes out of the millions and millions of people that follow have decided to reach out and you're altering your behavior for assholes.
Interviewer,I like those quotes I like when you when you when you break things down cuz I didn't know those things I like thinking about like the hair and grab it was like oh yeah I fucking shit be standing straight up in the only reason why I mentioned it but it was long here would happen to you but it was long hair in space it standing up on head Cheryl's it's a completely obvious thing that was omitted from the filming of gravity yeah but you have their hair and makeup deaf dumb reason exist so so what am I to I might take a poll I might put it by my pillow.
Tyson,how do I force feed curiosity have to listen to your feed no one else to wash it anybody anything you pretty offerings out there like you said is that for speeding and not knocking on someone's home wake up bitch read my shit that is true I'm not forcing myself on your property to hear me talk about your movie first I said BBH way cuter than artoo-detoo and I use like 5 days in the way just to just to start a fight cuz that that's a fun fight right then I said by the way aren't bb-8 a smooth metal rolling spherical ball would have skidded uncontrollably on sand.
Interviewer,in-home movies were moving around on Sand right yeah it would that's why you deflate your tires to drive on imagine Steele tires on a sand dune holy shush oh yeah so if you have a hard surface just below it a dusting of us and then you court yet then you can dig into it connects to the heart surface posted this and people you're ruining the movie for me and then people started these assholes again when you say people you just listening to assholes smart people going to read oh yeah yeah this is stupid it would roll around.
Tyson,yeah I'm just a fucking thing some tractor Treads it was actually happened as a result I think I'm getting phone calls from producers to make sure you don't treat them good so you keeping them on as you know I might be most famous among the movie commenting for the final scene in Titanic okay if you knew about this but would you say about the final scene we know where the Titanic sank the longitude latitude we know what time of day tomorrow so at the P of o v the point of view of rose as she's looking up deliriously to the sky is only one sky she should have seen it was the wrong sky.
Interviewer,whose horse that was worse than that the left side of the sky was a mirror reflection of the right side of the sky did you call James yeah I know the sky I dis is what I do yeah okay so no reply 5 years later I bumped into him at a meeting or NASA hosted meeting with some explorers and some scientists I brought it up to him and he says well at the time I was not overseeing post-production and that's when we added that I'm immature Lee 1in to grovel at my feet for forgiveness did you go to that one of them too but that's not what happened so then 5 years after that I brought it up again when I bumped into him and then he said you know last I checked the Titanic Titanic is earned more than a billion dollars worldwide imagine how much more it would have heard if I got in the sky correct.
Tyson,that's a stupid answer from an asshole so that was okay I have nothing more I can say you're cuz he's right okay no he's not he's right out of money and it would have made the same amount of money that's true but that's not the point but he's wanted you fucked up bitch week later I got a phone call so high I forgot he said I work post-production for James Cameron he's producing a director's cut where he's adding new footage and he tells me you have a sky he could use so the Centennial release of Titanic.
Interviewer,released in April 2012.
Tyson,oh yeah that's right yes so it's got so us we actually put it so he did come through so here's what happened Seth MacFarlane calls me up and said I'm making a movie about a talking teddy bear and I need to know the sky over a town outside of Boston in 1985 on Christmas Eve looking North Northeast.
Interviewer,you got a sky I said I could get back to you a half hour later I sent him this guy that was the sky that the kid wished on to Wilford where Ted came to life Ted had the correct Titanic did not see that one Titanic zero on that so the point is to put people started thinking about it and it's the highest compliment I ever got was Andy Weir who wrote The Martian.
Tyson,he said to himself while he was writing the novel he said cuz he's an engineer so he has the fluency and he's also knows how to write he's right creatively he said if Tyson were looking over my shoulder what would he would he tweet about this or not and so that put them on notice to make sure that his calculations were accurate and the Martian is one of the most entertaining Lee accurate Explorations how to invoke science to not die that there ever was so for me that was a very high compliment and it was kind of worth it all of the naysayers that to know that Andy Weir came through on that.
Interviewer,yeah so why stop I'll maybe maybe I'll change I think you need to learn how to post and drop or just think about it like this post a little walk away walk away just go do something else man you don't need to look at that shit you don't need to look at what people are going to say make sure that there's no typos that's always a struggle I care though I'm sure you do care about what how people can think.
Tyson,out what I wrote if it's a way that I had not considered.
Interviewer,ay I like knowing it it makes me a better Communicator when I'm in front of an audience I'll know what percent will think one way vs. another and I can modify what I'm saying to be more precise into as we say in physics to reduce the impedance between the signal in the receiver so if there's a better match between the communicator and the audience I understand that but if you see call jokes that people just took the wrong way oh yeah I'm trying to just didn't like what I'm saying but surely like you see the word cock in a response you know the person is an asshole right there's just certain things you just see like you're cook like okay enough to listen anymore now I know what you are right you see that still know the times are the fucking Sky instead of fill in the blank I get those are just assholes well I have pretty sure I can so it's not but it upsets me it's that I'm here to serve you not to piss you off or not.
Tyson,there's some people that cater they're looking to get angry and not real Avi.
Interviewer,the arrogance of thinking that you could fix other any plus years of worthless shitbag living with a couple of tweets okay.
Tyson,and you know something I don't even want to take you up on that challenge cuz you're probably right I'm telling you you got a lot going to walk away but for most people myself included in those most people I enjoy those tweets and I want something here's one so I tweeted something and somebody responded to somebody else's tweet said you know I don't really like Tyson he's such a he's so pompous okay so so I tweeted back to that person and I said thanks for your note but could you please share with me the single most pompous thing you've ever seen me do.
Interviewer,and you wrote back and said damn you would have to be reading my tweets with you I can't think of anything right now but overall I really like your work kick put nothing forward that happens all the time because people just shocked that you respond. Plus there is people can get into a stereotype mode where there is doubt that person is that and they're free every state they just decided they decide for the compass is that that's not your science educator.
Tyson,I interviewed on StarTalk I guess you were one of my gas but so too is Katy Perry that you're going to do people get pissed off cuz I said she she wrote a song by Boney an alien I don't want to find out what she was thinking there's always ways you can fuck Russell Crowe a few times or what's his name Peters sorry Russell I don't brand what is a bushel.
Interviewer,what's up Russell Peters a good friend of mine is like so what the fuck my brains out of it you're married I didn't notice so he's like an alien is my point is very odd. He's out there and I'll be like one of those guys that would be in the Men in Black aliens that they're tracking to remember that scene in the headquarters is a big boy wear to cover alien all aliens and you like Michael Jackson who just do something a little different about them you know so it would just be for the really do believe that the believe that there's aliens amongst us again and we live in a free country I'm fine but.
Tyson,you know what happens evidence at some point should matter but yet you find out about like Russian agents have been living in like New Jersey for like 30 years of the whole premise of The Surreal story to me really has happened on multiple occasions and so they wonder if the Russians won't do that what are the aliens want to do.
Interviewer,yeah so just find me one yeah maybe there are doing are you open-minded to that course oh my gosh I would love to meet the aliens have technology that we don't have to compare notes I want to oh my gosh do you go in the movie arrival.
Tyson,with a which one the Octopod to arrivals early arrival with Charlie Sheen land 7 freaky things with speaking ink ink right so so they said the physicist and an anthropologist Anthropologist a linguist and I tweeted I said you know if aliens come I would not send a physicist and Linkedin a linguist I would send it up an astrobiologist and a photographer.
Interviewer,but then the linguist got all upset and they've been started piling piling on what they all are but did you just look up the time what would her profession was so so they all piled up the big moment so I get it that's fine but there are a couple of things so for example there it is making these circles in their interpreting them but it's making them on glass so how did you know we weren't seeing them the mirror image of what he was trying to communicate that's that was not addressed in the film back but cuz your protection is of extreme importance but this happens at all Sci-Fi movies you go up to this thing you get lifted up against the force of gravity.
Tyson,that point I was just put down all my weapons.
Interviewer,what's going on it's way beyond your understanding of the laws of physics yeah you know it's like pulling out your pistol is shooting at the spacecraft across half the Galaxy 2 to come to you what are you doing clearly Superior to you in ways that you don't even know yet so just find another way to do your talking rather than sending bullets their way but is not always the case in every film I mean it's always part of the narrative is that the Primitive people fuck it up for the advanced civilization is coming here to help us or yeah it's never been good for the less technologically advanced civilization ever ever ever been going on right now currently not to sound pluggy but this one of the profiles here is a Captain Cook just a quick visit Hawaii only a couple of times in my life one of times I saw Don Ho in the show.
Tyson,he only sat down he's like big and heavy and old and he died a couple decades ago and heat the someone someone answer whatever happened to Captain Cook you know how you reply she said.
Interviewer,nobody's ever seen him since.
Tyson,people listening he's making things like he's picking things out of his teeth.
Interviewer,Motor Service in Captain Cook of late so is rumors are that you eaten by natives that happened to a lot of pirates so the bridge send Captain Cook to the South Pacific why will you look at his marching orders it's up there is what call the transit of Venus that's going to take place visible only from the South Pacific this is where are orbiting Venus it's in orbit are such that went Venus passes between us in the sun it actually is exactly between us in the sun you can watch it move the circle move across the Sun surface that it's rude device Okay so.
Tyson,if you measure that you can learn the exact scale of the solar system so you learn deep scientific knowledge about how far away the planets are and how far away the Sun is from the earth it was not known with Precision before that measurement was made so Captain Cook goes on his voyage to do this what is a pretty expensive Voyage flip over the marching orders open the envelope there use these new navigation techniques that use the sun moon and stars and map every Coastline you find and bring that information back to us.
Interviewer,within 10 years of Captain Cook navigating the South Pacific as well as the northern coast of Australia and New Zealand within 10 years Britain took control over those coastlines.
Tyson,pick a part of the British Empire.
Interviewer,hegemony at its finest on the premise that ease observing something about the universe but there was a tandem role that he played I did not know they knew that much about the cycles of the planets that they could be there they knew accurately they could be in one of the motivation part of the motivation of knowing any of this was navigation around the globe was navigation to know where you are on Earth you can get your latitude that's just the altitude the height of Polaris the north star above the Horizon measure that at night you can wait that long you know where you are and longitude ships would would be shipped with millions of dollars worth of Commerce would be at the bottom of the ocean because they didn't know where Coastline was the only way you can make a coastline and see if you have good navigational tools and tactics which involves an accurate chronometer a time keeping device for your brick and knowing what the Sun.
Tyson,when stars are doing in your sky so the astronomer in that day was crucial to the mapping of the earth and whose mapping Earth is it just geologist for fun no it is Nations wielding power over regions beyond the beyond their own coastlines hear back from 17 what do I get to 1757 James Ferguson.
Interviewer,1757 here's a quote of all the Sciences cultivated by mankind astronomy is acknowledged to be and I'm doubtedly is the most Sublime the most interesting in the most useful for by knowledge derived from this science not only the bulk of the earth is discovered but are very faculties are enlarged with the Grandeur of the ideas of conveys our minds exalted above their low contracted prejudices notice he lifts mapping the Earth First.
Tyson,very talks about how exhausting and a grander so yeah it's an exercise in dominance in hegemony in power under the guise of studying for all this texting help there's an auction to little earlier the the the the Muslims used in extra laid okay dude got by the way what's the number it's a third or two is that I forgot that the fraction around a half of all stars that have names in the night sky have Arabic names.
Interviewer,because in the Golden Age of Islam a thousand years ago navigation was a big deal and they navigated using astrolabes which is sort of the the the Islamic counterpart to the Sextant octant they were used what is Master P or ask her if you can find a stroller that looks so different discs that you can replace the penny of where you are in Earth to be to know where you are more accurately so this is all navigation so that was almost like chips for a GPS device found that somewhere you go ok aliens been a heavyweight.
Tyson,Champions at thousand years ago so you know this is 700 years ago 600 years ago 5 the Ottoman Empire and spreading their influence and they've got they've got astrolabe to this is this song you don't even worry about this in school can only hear about the rest of Europe Christian Europe.
Interviewer,so this mess device and these are dolls that turn looks like I would have had to complete looks like art it looks like some bizarre looks like an alien and simpler one that has the spirit of an astrolabe but I don't know that if they would have called that an astrolabe the other think they go way back and so detective the most decorated ones or the ones from the Middle East the point is.
Tyson,GPS is no different from the navigation Tools in in concept from the navigation tool that Captain Cook invoked for Britain to then take control over all the South Pacific that they did it is where are we and do we know this information with precision.
Interviewer,and so and what happens if an enemy for steaks out our GPS and we have so much depended on it what are we going to do we got people now working on using navigation by pulsars can't take those out cuz those are cosmic you're sending highly time two pulses that reach Earth in different places on the sky and by measuring them you can and the time delay between one and the other you can actually localized yourself on her surface with extremely high Precision it without any use of satellites.
