name,line
Interviewer,"Dr. deGrasse Tyson, it's great to be with you here at the 68th Annual American Humanist Association Conference in Phoenix, Arizona. Is this your first humanist conference?"
Tyson,"My very first. I didn't even know they existed. I guess I'm a little out of it, being a scientist all my life."
Interviewer,"Well, we're really glad you're here and that you've discovered us, in a sense. What are your impressions so far?"
Tyson,"Everybody is friendly, the topics are all very interesting, and it's clear that there is quite a lot of work to be done to make sure we have the country that we all thought we were given 230 years ago when it was founded."
Interviewer,Do you consider yourself a humanist?
Tyson,"I've never identified with any movement. I just am what I am and occasionally a movement claims me because there is resonance between my writings and speeches and what they do, and that's fine; I don't mind that. But no, I have never been politically or organizationally active in that way. Astrophysics, that's what I identify with."
Interviewer,"And as an astrophysicist, do you find it a challenge that people may be less interested in the actual science that you're doing and want to hear more about your position on science in our culture?"
Tyson,"The relationship of science to our culture is of fundamental importance in the twenty-first century, where whether or not we embrace science as a nation will play directly into our ability to compete economically with other nations that already value what it is to invest in science and technology. Whatever people feel the need to explore with me, I'm happy to go there with them. I spend enough of my life as an expositor of the frontier of science; I don't need to do that every time I'm in front of an audience. Clearly this  audience has an important mission ahead of it and I would be very happy to share my life experiences with regard to that mission, compare notes, and look for best and worst practices."
Interviewer,"People argue that Dawkins and Hitchens and others are raising the profile of nontheism in general. But human beings are complex and even conflicted at times, so it's reasonable to think about re-tailoring your approach once you have the spotlight. Certainly in science you want to ask questions and then go in search of the answers. I do think scientists working as scientists and touching on these issues are really the best spokespeople that we could hope for. So thank you so much for doing what you do."
Tyson,"You just put an even greater burden on my shoulders saying that scientists have to first figure out how the universe works, then we've got to get it out there to the public!"
Interviewer,"Speaking of the public understanding of science, you've talked about getting letters from kids and so forth. Do you do much in science education with children?"
Tyson,"Hardly any of my professional activities directly target children. At the American Museum of Natural History there is an entire education department made up of people who are trained in K-12 cognitive processes and curriculum. Occasionally I come in and make a presentation for the kids. That being said, the books I've written are very readable by kids, and the TV show that I host, NOVA scienceNOW, has a playful spirit that kids can enjoy and that resonates with them."
Interviewer,"Your ability to communicate science and your ideas is so sharp. As a writer, as well as a presenter, do you find that you have a very specific technique for communicating?"
Tyson,"Technique implies that one invokes a method. And you repeat that method because it has shown to be successful. What I've found, however, is that one should not have any method at all because everyone is different, and so you come prepared for any audience at any time, any age, any demographic, any political leaning, tolerance for humor, religious sentiment, and so forth. All these factors influence the ability of a person to receive the message you are giving them."
Interviewer,Have you shared this imperative with teacher groups?
Tyson,"I gave a talk to the National Science Teachers Association. That is an important group of people, K-12 educators in science. I asked by show of hands how many people, because I knew it would get an interesting reply, didn't own a television. Half of the hands went up. Of those who owned a television, I asked how many only occasionally used it to watch a movie, and half of the hands went up. So fully three quarters of that audience whose job it is to teach the next generation science don't watch television, yet the average American watches thirty or forty hours of television a week. That disconnect is pedagogically fatal."
Interviewer,I imagine that was a little controversial.
Tyson,"Yes, and when I say pop culture I don't mean only the TV shows that are kind of cool and interesting. I also mean the hit shows. I'm talking about Dancing with the Stars. I'm talking about the reality shows most educators thumb their noses at as being of no educational or intellectual value. Yet clearly millions of people watch them every week so there is a disconnect. Once there is a disconnect, you're not communicating."
Interviewer,The message I'm getting from you is of an unending need to understand human beings as both complex and able to be stimulated with the right approach. Thank you so much for communicating it to us so effectively!
Tyson,"Any moment would have been good, but it's a matter of how many forces align to actually make it happen ... It's not that it's now versus three years ago. It had to happen no matter what. Anywhere between 30 and 35 years is a typical length of what people think of as a generation. There's got to be at least one Cosmos a generation; otherwise, we're not doing justice to sharing with the public the role of science and bringing the universe down to Earth."
Interviewer,Can you give a few examples of the ways the science on Cosmos has been updated? Will the new series incorporate any discoveries of the past 34 years?
Tyson,"If you only think of Cosmos as a science documentary, then the natural obvious question would be, Well, it's been 35 years. What has changed? However, Cosmos wasn't only that, and it wasn't even mostly that. Cosmos is mostly Why does science matter to you? Why should you care about science? Why should society care about what scientists say? How can you empower your own destiny by becoming scientifically literate?"
Interviewer,"What is our effect on the environment? Will we be good shepherds of this Earth as we go forward? Do we know enough to be good shepherds of this Earth? Do we understand the risk of asteroids that could render us extinct? These are broad questions, and Cosmos takes some element of science and shows you why it is way more relevant to your life than you ever previously imagined."
Tyson,"Well, there's always creative tension, and that's never a bad thing if people who are participants in the creative tension are intelligent and rational. Intelligent, rational people can disagree and figure out why they disagree, and maybe you go with one person's view or another person's view. Or, the disagreement leads to a third view that one or the other didn't have, and the third is better than both. So, all three of those scenarios would happen."
Interviewer,What was the most difficult part of making the reboot?
Tyson,I have an unromantic answer for you there
Interviewer,"You make such a great tribute to Carl Sagan at the end of the first episode, when you talk about your first meeting with him during high school. How has this project been important for you personally?"
Tyson,I have a personal philosophy in life
Interviewer,Did you meet Sagan any other time?
Tyson,"I'd say we only met like four times. The first time was very significant to me, as is obvious from that retelling. The last time is also significant. It was his 60th birthday bash. He would die two years later. It was a celebration, it was a dinner and there were all these testimonials. And you would sit there and listen to all these testimonials, and you would say, My gosh, nobody could be that amazing. You know, old people, young people, middle-age people, colleagues, janitors were coming up, singing the praises of Carl Sagan. And then, after that, he gave a public talk, and it was the best public talk on any subject I had ever heard in my entire life. Not the best, the greatest. And I said, Yep, he deserves every one of those accolades. Every one of them."
Interviewer,Where were you in your career then?
Tyson,"I was well established. I knew when I first met him that I wanted to study the universe. I was not one of the people who was turned on to the universe by him. His influence on me was recognizing that there is an appetite for a scientist who would sit down on the couch next to you and talk about the universe. That's what he did when you saw him on television. He's sitting right next to you. Not as a professor, he was a guy just trying to get you comfortable with the cosmos. The fact that that was possible, the fact that a scientist had talent to do that, the fact that people responded so warmly to it, told me that if I'm ever in the position to bring the universe down to Earth, that's a good place to start."
Interviewer,"I wanted to bring up Bill Nye, I hear you guys are friends."
Tyson,"Yeah; in fact, I count him as my best friend. In modern times, he's my best friend. We text and email three or four times a week about one topic or another. We are sort of compatriots in this business, so we're always comparing notes and seeing how we could improve; we offer critiques, that sort of thing. There's professional value to the friendship that manifests."
Interviewer,"What are your thoughts on the debate on evolution Nye recently had with creationist Ken Ham? Nye said he was doing it to raise awareness about science education in this country, and it seems like Cosmos might have similar aims."
Tyson,"There are different ways to do that. One of them is to legislate laws that will improve science teaching and the like. But think about all the ways your citizenry can be influenced. We all go to movies. We all watch television. And some movies are better than others, and some TV shows are better than others. What makes them better? Some are better filmed. Some are better written. Some are more compelling. Different people learn differently and react differently."
Interviewer,"Speaking of science and religion, I thought it was interesting that Giordano Bruno's story was incorporated into the very first episode.  Can you tell me about that decision?"
Tyson,"There are many science martyrs, if you will, whose stories are undertold. And there's the normal cast of characters, Einstein, Galileo, Newton, and we just figured, we've heard those stories before; let's go deeper. And Ann Druyan and Steve Soter are both avid historians, not in an academic sense, but they're very well read in terms of who did what in the past. It's through their collaboration that they came up with this list of people whose stories we'd tell. And Bruno is just one of half a dozen profiles that are featured throughout the series that tell you about the scientific result arrived at by a researcher and what comes when those results encountered the social, political, cultural and religious mores of the day.."
Interviewer,What was it like working with Seth MacFarlane?
Tyson,"He was primarily our broker, not a literal broker, but a figurative broker, who brought Cosmos to Fox, because he's a Fox entity, of course. And why would either we or Fox think that we are a good match for each other? We would not be Fox's first thought; Fox was not our first thought. It was Seth who put the two together, recognizing that Fox needed something like Cosmos and that it could put resources to bear on it."
Interviewer,"For the record, we're HUGE fans of Neil deGrasse Tyson. (You don't put someone on the cover of your magazine if you don't love him!) In our excitement, we dreamed up lots of cover executions, but ultimately, we decided the most fitting treatment would be to have him beaming from the center of the solar system. Here's hoping you like the interview as much as we do!"
Tyson,"When he was 17, Neil deGrasse Tyson got a letter from Carl Sagan, the Cornell astronomer and popular science luminary. Tyson was a Bronx High School of Science student applying to colleges, and Sagan invited him for a tour of the lab at Cornell. It was ""an act of generosity that has affected me my entire life,"" Tyson says. A few years later, in 1980, Sagan launched Cosmos"
Interviewer,"Not long ago, you tweeted that if we imagined our planet's history as a football field, human existence would fit on a blade of grass."
Tyson,"Yes. If the 14-billion-year history of Earth went from end zone to end zone, then the width across one blade of grass is about the time that has elapsed since the paintings of cavemen to this conversation. That's a cosmic perspective."
Interviewer,How has the cosmic perspective shifted since the original Cosmos aired? What advances in science or new issues have you had to incorporate?
Tyson,"If you go back 40 years,  the environment was ""don't pollute the lake because then you'll kill the fish, and it will mess up our little water hole."" No one was thinking that what they did locally would affect everybody else globally. The local-global connection has emerged in the last couple of decades."
Interviewer,"I was reading a collection of Sagan's Gifford Lectures, The Varieties of Scientific Experience, and he really did have a way with words. He was talking about our sun going supernova, and he said, ""Some five or six or seven billion years from now, the sun will become a red giant star and will engulf the orbits of Mercury and Venus and probably Earth. Earth, then, would be inside the sun, and some of the problems that face us on this particular day will appear, by comparison, modest."" He has this implicit humor."
Tyson,"There are plenty of smart people out there who don't know science, and plenty of socialized people who might not be smart. He had all of that in the same package."
Interviewer,What was your relationship with Sagan like?
Tyson,"We met only four times. So he was never a mentor. People think that, but that was not the case. But those four times were significant, so I think of him often, and they serve as a source of inspiration. The fact that he took the time for me  has shaped how I take time for students who reach out to me."
Interviewer,How did the new Cosmos come about?
Tyson,"After he died, I got a phone call from the board at the Planetary Society, an organization that he cofounded, asking me to join the board. That was a little bittersweet, because clearly the spot was vacated because of Sagan's death. It was that acceptance that got me closer to his widow, Ann Druyan, who was a cowriter of the original series and is the writer of the current series. This is 1997, I think, and the conversation about doing Cosmos and continuing the Cosmos legacy had always been there. The question was, ""How would we do it? Who would write? Who would be in it?"" And Ann might have had other people in mind, I don't know, but I knew it was something I could do, possibly uniquely, given my sentiment for Carl and the impact he had on science literacy in the country. And given the rising impact that I was having at the time, I felt, yeah, I can do this."
Interviewer,So are there going to be shots of you walking by the beach with the breeze blowing through your hair?
Tyson,"Afros don't respond to breezes.  the fact is, we have stunning visuals knitted into stories of how and why science matters. So I'm on camera only if it's really adding to that delivery."
Interviewer,Somebody has to man the helm of the spaceship of the imagination.
Tyson,"Yes. Those are some of the most fun scenes I filmed. The spaceship looks to the past, the present, and the future through portals in the ship. Of course, it's all done with a green screen. But because I feel very close to the universe, when I'm describing what you're seeing, even though I can't see it, I can see it. In my head, it's there. As we descend toward the sun's surface, as we descend into strands of a DNA molecule, as we go to the limits of telescopic regions of the universe, I am there."
Interviewer,"Seth MacFarlane, who is one of the producers of Cosmos, recently did an episode of his show Family Guy, where the dog, Brian, died but came back in some kind of time travel twist in space time. Were you consulted on that?"
Tyson,"When Brian died, it was tragic, and I thought, ""Well it would be sad if he's not there because he's a unique voice in the program."" Stewie had the time machine already, right? So the show had already involved time travel, so  had lunch, and he asked me 20 questions on the space-time continuum and multiverses. Six months later, there's a show. Stewie takes the time machine, goes back to before the big bang, in fact goes outside of the big bang, where he is neither in a time nor a place, and it's out of that fluctuation in his time machine that the universe gets started. And at the end, an entire title card says"
Interviewer,"On the issue of parallel universes, do you think there is an evil mustache-less Neil deGrasse Tyson out there?"
Tyson,No. I think you need more than an infinite number of universes in the multiverse to have a universe that has someone who is exactly like me but is evil.
Interviewer,And without a mustache.
Tyson,"Usually, the evil person has a mustache. But my evil twin would have to be mustache-less, I suppose. When everything else is identical except that Neil is evil, I think we need more than an infinite number of universes for that. There are orders of infinity. Most people don't know this. Some infinities are larger than others, so you can show mathematically that that's the case. So I just think if you had infinite universes, that order of infinity is not high enough to create an Earth that has everything else exactly like it except that there's an evil version of me."
Interviewer,So is space a human abstraction or a physical entity in your opinion?
Tyson,"It's our perception of reality limited to how our senses deliver it to us. It's only in the era of science that we can decode the operations of nature outside of those five senses. And we've come to learn, since the era of quantum physics in the 1920s, that the results of your experiments are to be trusted above whatever your senses are telling you. Your senses are actually quite useless in this regard. They're not only useless, they are actively misleading. So you design your experiments, and you trust the results of your experiments. I'm still going to operate based on the reality that my senses give me in my day-to-day life."
Interviewer,"In 34 more years, if there was another installment of Cosmos, what questions would it address?"
Tyson,"Part of the mystery of science is not even knowing yet what question to ask. For example, in the year 1799, the question, ""I wonder if an asteroid will ever strike us and render us extinct"" could not have existed because we hadn't discovered asteroids yet. And even after we did discover asteroids, the idea that maybe one would hit us was not a thought for another century and a half, until we figured out that the crater in Arizona, which then was known as Barringer Crater, is now known to be the product of an asteroid impact and quickly renamed it Meteor Crater. The fun part about the future is not even knowing what questions to ask."
Interviewer,"Right, because five years from now, some alien empire could invade and change our understanding of everything. There's no way to predict that."
Tyson,"Exactly. And it will re-shift, and it will readjust how we pose questions. And what we pose questions about."
Interviewer,"A few years ago, I sent 10 dollars into something called the Time Travel Fund, with the idea being that the interest accrues, and far into the future, they take that money and come back in time and save you before death. What do you think of that as a retirement plan?"
Tyson,"I think it's great if it only costs you 10 dollars. Think of all the stuff you might spend 10 dollars on that wouldn't be nearly as fun to think about as that. If anything, you get novelty value from it. Not enough of us embrace the value of novelty."
Interviewer,This is probably the most profound extinction of animal life.
Tyson,"For years, the killer was a mystery, but now researchers think it could be something we're all familiar with, today."
Interviewer,Smell that.
Tyson,"Ooh, yeah, smells like rotten eggs."
Interviewer,"Rotten eggs, yeah. This is..."
Tyson,And the trigger could be all around us.
Interviewer,...this terrible gas chamber atmosphere. It's not so much stuff from space that gets you; it's your own planet.
Tyson,"Talk about extinction. This scientist has brought back to life one of the most lethal viruses in history, the 1918 flu."
Interviewer,"This killed, probably, at least 50 million people worldwide."
Tyson,What was he thinking?
Interviewer,We felt like it was important to actually reconstruct this virus.
Tyson,"What he's learned might unlock the secrets of how the avian flu, the one we're worried about now, could spread, infect and possibly kill millions."
Interviewer,Maybe we can figure out how to stop it.
Tyson,And you'll meet this guy...
Interviewer,"Hello, Leo. Can you hear me?"
Tyson,He was designed by an engineer who's building sociable robots.
Interviewer,You're such a cute little robot.
Tyson,"Robots that one day may even become our friends, with feelings and emotions. Wait a minute, an emotional robot?"
Interviewer,"I do think, in time, people will have, sort of, relationships where they might feel that it is a friendship, but it's going to be of a robot-human kind."
Tyson,All that and more on this episode of NOVA scienceNOW.
Interviewer,Google.
Tyson,"Hello, I'm Neil deGrasse Tyson, your host for NOVA scienceNOW."
Interviewer,"So yeah, this looks good."
Tyson,"And I mean old; the victims were knocked off about 250 million years ago, in an ancient mass extinction."
Interviewer,"Based on the fossil record, this is probably the most profound extinction of animal life."
Tyson,Geologist Sam Bowring and paleontologist Doug Erwin think this hillside might be a scene of the crime. They're looking for clues to find out what caused the mysterious end of the geological time period known as the Permian.
Interviewer,"The Permian world, and the extinction that ended the Permian world, really reset the nature of life on this planet."
Tyson,Paleontologist Peter Ward has spent years collecting fossils from the strange time of the Permian.
Interviewer,"Permian would have looked very different to us. Let's say we go back there, we look around"
Tyson,"True mammals hadn't evolved yet, but their ancestors were there, animals like this Lemurosaurus."
Interviewer,"This is a mammal-like reptile, probably small-dog size. This animal is a carnivore. It really has a dog-like appearance. We can see this great big piercing tooth."
Tyson,Clearly making him a predator.
Interviewer,"Yeah, but this entire group dies out in the extinction itself."
Tyson,"There were creatures right out of a science fiction movie, like plant-eating Lystrosaurs, and, ruining their day, monstrous Gorgons."
Interviewer,"I went into this controversy fully expecting to find all the evidence for impact. And at the end of the Cretaceous, we see this. We see lots of comet material or asteroid material."
Tyson,"Not to mention the crater, of course."
Interviewer,"Not to mention the crater, least of all the crater."
Tyson,"So you've got the smoking gun, the gun, and the bullets, and, of course, the dead bodies, I guess."
Interviewer,"Well, the only thing we have at the end of the Permian is...are the dead bodies."
Tyson,"So, if asteroids and extinction don't necessarily go hand in hand, what does Earth do with all those asteroids that come our way?"
Interviewer,"The Earth is hit by asteroids all the time, big ones, doesn't cause mass extinction. Why not look for something a little bit different?"
Tyson,But where can we find that something?
Interviewer,"Here's the boundary, right here."
Tyson,"This Nevada hillside might be one of a few existing Permian crime scenes in North America, but the team must date the rocks, to see if they're the same age as the extinction."
Interviewer,Timing is everything. You have to have rocks that can be dated precisely.
Tyson,"Back at the lab, the team breaks down the rock. Rare elements reveal when the rock formed. The results? About 250 million years old."
Interviewer,"Most people, when they think of volcanoes, think of Mount St. Helens or Mount Pinatubo. That's nothing like these volcanic episodes."
Tyson,"The Siberian Traps oozed lava for up to a million years, smothering an area about the size of the continental United States, in some places, over a mile deep."
Interviewer,That is a lot of lava.
Tyson,"Sure is. But still, the lava was in Siberia, not in the rest of the world, not in the whole ocean. So why would almost everything on Earth die?"
Interviewer,So the model starts out like a weather forecasting model or a climate model
Tyson,"All plants and animals and bacteria are, in fact, chemical factories, taking in nutrients and spewing out waste products. With life's chemistry factored in, Lee's model reveals a disturbing chain of events."
Interviewer,Carbon dioxide that's spewing out of these volcanoes is a greenhouse gas.
Tyson,"Greenhouse gases trap the Sun's heat in our atmosphere, forcing the whole Earth to warm up. Of course, that's global warming. But it doesn't end there. Global warming would have heated the Permian ocean, and when it did, ocean chemistry would have changed dramatically."
