name,line
Tyson,I'm not complaining about it I'm just describing as a reality I get it I just didn't understand the the comparison to car manufacturers paying for that they say if I make them car and I want you to buy my car I need a road so I'm going to build the road oh wait a minute I convinced you to build a road that's even better oh my gosh I made it a national priority oh it's a security problem we need a we need a military design Interstate System that's what the interstates its military that's why it goes through mountains instead of over them that's why they're long stretches of straight away so you can land an airplane on it that's why they built above the road that's why the surface roads are not the same thing as highways because the highways are not on the surface because they built up why because tanks can drive on them without decomposing the road what's specs did we put this to to the Autobahn the Germans invented the modern highway system they invented the Cloverleaf they invented the off ramps they invented all of that and their armies can move on their roads like it was nobody's business and eyes.
Interviewer,Howard said hey we will get me some of that he comes that's probably not how he said it I'm guessing but he comes old convinces us all that we need to build an internist I got nothing against the interstate system I'm just giving you the foundational facts for it and by the way Interstate System cost as much as going to the Moon about a hundred billion dollars in total cost seems like a bargain compared to how many people use it versus having to watch the moon and it grows the economy that has a lot of a lot of but basically it was sold as a as a security need because if you're at War you need to move materiel and personnel and you might have to land an airplane in an emergency way and so all freeways do this you're gonna crash a plane do it on a freeway.
Tyson,happens yeah but do it because you might land safely and if you don't land safely the road comes to you to get to the hospital don't crash in a forest we can't get to you right can't get emergency vehicles good call yeah you know if you seen this new Porsche has a new electric vehicle that they're about to release in this revolutionary groundbreaking technology what allows from recharge much faster you could charge up to 80% in 20 minutes because it's double the well pull up the information was it wattage or amperage well what just just a couple of things lunch different batteries can't cheat physics so so yes some batteries charge faster than others but what's what really drives the charging speed of battery is the is the voltage over which you charge the battery and it goes as the square of the voltage right so Supercharger so if you charge a an electric car in your.
Interviewer,hundred and 20 volt home electricity it could take 30 hours if you go to 240 volts okay it'll take you know ten hours if you go to 384 volt so you keep going up that drops precipitously and you can get a voltage where the thing will charge in a few a couple hours yeah we have a supercharger here we do yeah we have some set up here for my Tesla so there you go with special yes quickly the s yes yeah cool piholland yeah so you charge it and at most 90 minutes I'll think they call it that anymore I think they aren't the only superchargers know there's the the the Tesla I think they call it a like they have like an S Raven they have anymore no it's not the p100 D that's the that's the heart they don't call it a capacity okay now they I think they have a based on whether it's a single engine or double engine they've simplified things that's a removed all the labels to make it a little Slicker sleeker so did in the Porsche is it just the.
Tyson,up there selling a higher voltage charger to you or is it is the battery so completely different Google 10 interesting things about the new Porsche to I can how do you say that I can that's the Articles reading to them that's cool so my concern is batteries are still kind of 19th century technology yeah you know invented the battery voltage Alexandra Volta that makes sense he's cool yeah voltage voltage results come from him vole yeah all these guys got you know they got famous so that Tesla we got a car named after the guy had a nose a car there's actually a unit of electromagnetism named after Nikola Tesla well yeah it's Weber's per square meter I say so it's a it's like the the density of magnetic field strength within a certain area through through a surface so Betty charge bite inductive plate the.
Interviewer,"wretched Porsche claims it's a Porsche Turbo charging system charges at 350,000 watching kilowatts it 15 minutes eighty percent in just 15 minutes oh that's cool it's not clear how Barry Marshall will prevent battery overheating maybe they won't have a good luck bitch so God could be vaporware but we'll see but what they've already been doing it what but it's game on that's what that means yes game on whether it works or not it's like people Tesla's on notice everybody's on notice yeah oh my gosh I'm going to lose market share because people want to buy an electric car and so you didn't want something that's going to charge fast and that's the number one complaint that most people have over electric car or you find a way to okay so that's one way but another way is you find a way to swap batteries as quickly as it in less time than it takes to fill a tank yeah you know how much time do you stand there with your hand on the nozzle waiting for the gas to go in right so they would have to have a mountain of battery sitting there waiting for people to just come in and take it any worse than a mountain that that it did a than a."
Tyson,one can reservoir tank of gas there's no different what caused that any different probably larger volume right possibly but so what if it's economic you just do it right and you get the batteries all at the bottom of the car and it's going NASCAR you run in pop it up take out the battery put this on your off do you think that's the future why not that's better than charging the battery you don't have a cardia know I do I add as of yeah I do have cars now keep didn't used to I didn't used to so expensive as hell to garage it in New York they just went up the price just went up the big the big price point of that was when did the average cost to garage a car for a month in New York's in Manhattan equal the average cost of a two-bedroom home in the United States and we passed that cost of rent.
Interviewer,yes you have a question or two it was like some $600 a month or something to rent a parking spot to read a parking spot right one spot one spot I'm not sounded every month you can rent a home in many places in the suburbs somewhere for 600 kind of car you drive so I now have a Tesla yeah so I ponied up there expensive by the way sorry yes I have the X so that's my sort of utility vehicle the x is there the SUV a very high acceleration as you know and but yeah I did there's no maintenance on it right there was no oil change there's no you know the only moving part is the what you turn in the wheels with right the no Pistons nothing so you know cars really should have been this a hundred years ago and then we would have had a hundred years of clever engineering to perfect that gives you the documentary who killed the electric car no I haven't but I know about it and I know some of the background story behind it and the electric car was one of the first concerns because electricity was all the rage a hundred years ago what's Electrify the city's this days.
Tyson,this Edison there's test everybody wants to do everything electric and the car had just come out let's do it electric so this was not a New Concept and it's unfortunate that more sort of innovative thinkers hadn't been brought to task on how to perfect the electric car speaking of Tesla and electricity will what did you think about Teslas initial idea that Westinghouse shot down to sort of broadcast electricity so people could just pull it out of the air yes so the people in the Nikola Tesla fan club somehow feel that he got wronged in his life okay and surely some of that is true with regard to Pat his business Acumen and patents and who owns the patent and who does does he have good business sense is he is Savvy or as as sneaky whatever other words you might apply to Edison all right so I get that.
Interviewer,but his contributions to electromagnetism are real and recognized in the world of physics like I said there's a unit of electromagnetism named after him so don't come crying to me say he was not recognized by my people okay he's recognized he had some ideas that were a little out there and out there on a level where.
Tyson,it almost certainly would have not worked and here's why okay electromagnetic energy is communicating between us I see you that's because visible light is reflecting off of your scalp okay to me it's reflecting off of my nose back to you you can ask how much energy is in that will not much it's not much energy in a visible light photons if you stay too long enough you might feel a little warmth from it but no you're not going to drive a car with that energy and not going to run a motor with it okay.
Interviewer,well if what good is it oh you know what we found we can use electromagnetic radio waves which are the lowest form of electromagnetic energy lowest energy level of all over there we can use right away is not to transmit energy that's not the point of it the point is to transmit information and information became what characterized the modern era and that's why in the 1950s and 60s when everyone is imagining flying cars and motorized sidewalks everything is running on energy because they're thinking energy is going to be free in the future but they didn't figure was that information would be free or easy to transmit and to generate and to store and to to delete and whereas the energy that would take to move things and to drive things that would be a problem no one saw that coming nobody saw that coming so.
Tyson,as your photons get higher and higher energy yes you can start doing things with them yet X-rays and gamma rays but that's not what Tesla was referring to he was talking about moving radio waves through the space that would charge things up you can't pack sufficient energy in your radio wave to do anything we need to do mechanically currently current well back then would it be sufficient it might have been something you could have done with your radio waves because the needs were no but that knows no I take that back that was the height of the Industrial Revolution that was the age of the machine the age are the giant turbines radio energy is not touching that well but wasn't it possible that he was considering it for things like radios or light bulbs or household items would it be possible to use that power for that.
Interviewer,so now what so what happens so the radio waves if you had enough power and radio waves to generate a light bulb to power a lightbulb well hat through the air Are you standing in the way of this this energy has Pathways we now send energy through wires because you're not standing in the way of the wire the wire is buried the wire has insulation it would require sort of suspension you want to move it through the air and you want to walk around like no that's not how that works what up but I've heard people moving in our energy through the air to power something that itself could kill you.
Tyson,the energy powering through the moving through the air could kill you unless you you bring a little bit amount and then you store it and then use it later you could do it that way.
Interviewer,sure some sort of batteries yes you need a storage system but you would still probably have some sort of residual effect of having this stuff broadcast through the air and who knows what it would do to human health if you needed that much energy right now the energy to transmit information is so low that it no it has no effect on your health that's why I can pull out my cell phone I'm in a brick with this fake brick is fake brick I'm in a bills rubric that no it's not this it is go touch it I don't believe you go ahead was a real Brooks go touch the bricks man Jesus Christ thinks we got fake bricks who do you think we are.
Tyson,okay oh you thought I was a liar how weird.
Interviewer,now let me be honest so so it's a venir a brick veneer okay so the whole thing I real building so it's not structural brick slice the end up bricks and then they mortar it in and everything real bridge and make it look okay so so we're both right but it's not structural real favor so here I am I'm real fake so we're inside I can put my cell phone and have a phone call yes these are microwaves of a frequency that can penetrate walls send information to my cell phone and I can communicate using information and not have that energy kill me but it's not enough to power the actual it is not enough to power the device correct so anticipate esoteric everyone is thinking he's got the solution to the Future transmission of energy no he doesn't well I don't think anyone saying that but he sent his fans do but back then there were no computers back then there were no television but we did have machines it was the era of the big machine right but I don't think he was insinuating that you could use.
Tyson,don't know what he wanted to factory I don't know what he would have powered with it if not light bulbs and other things you know one thing you brought up that's really interesting you talked about light reflecting off of things you wear that BMW painted a they painted one of their cars vantablack I saw this is the jet black yes I saw my soul and recently lack yeah no light can bounce off of it and so not only can't drive it because people won't be able to see it at night it literally saying like this is just a theoretical be just like what would you want to do you could line it was with the pull of trim edge of it because Mercy I saw one in a parking lot it's fuck it's very bad as she saw one in real life it's that's not what I saw I saw a sports car ocean saw vantablack car they have them I saw a sports car that was it was not exactly the car you have up the I don't know what that is what I saw BMW that they painted vantablack okay well then Advance the black is available on their badass low to the ground sports car and so what I'd know it's not available commercially what do you want me to say I'm saying that for BMW it's not.
Interviewer,it's not something they're off I'm in La you have all your cars here and he said if everything showcase here what I didn't see it in New York I saw it here in La well I'm sure some may be wishing to be a preview maybe somebody else did and I'm just saying BMW if someone did it BMW didn't make it themselves okay someone must have done I mean you can do it it's a real thing vantablack real collar so one of the principles of stealth is that if you send a signal to it it never comes back to you so you have no sort of radar measures of its existence correct but there are two ways you can do that one of them is you cannot reflect back.
Tyson,okay but by absorbing it right okay so jet matte black will absorb it and not reflected back but if there's enough energy coming at it it will heat up because you can't get something for nothing here it'll heat up the skin of that and could be bad for the occupants that's what they said about the article the article about vantablack if you put that in the desert forget it well they were saying even in Los Angeles you are so hot exactly dick so another way to do it is the signal comes to me and I reflected in a direction that is not back to you.
Interviewer,so the B-2 bomber is not only non-reflective back to you it takes the signal and reflects it and double bounces it so that all your energy gets sent in other directions and not back to you so it doesn't then keep the energy that was sent to it so that's another way to do it another there's another stealth which was featured in one of the recent not recent four years ago James Bond movies where light that comes at it the light that's behind it.
Tyson,goes around it coherently and continues to come towards you so that you think you're seeing what's behind it and it's not there you are seeing what's behind it but the path of that light went around the vessel and continued on its way to you.
Interviewer,so you think you're just seeing the grass in the tree but there's a car sitting right there.
Tyson,you know about this technology no yeah right now it exists only for very look up stealth light Ray stealth and so the material has to be able to know what is behind it you saying small objects only so not only with that only works in one site line whereas if you needed functional stealth everybody looking at it should every path every sight line to it should be able to see what's behind it on the other side of that side of the way it reflects things but yeah it's it carries the light beam around it and sends it out the other side you have to find it yeah.
Interviewer,you know what you have is you just look like a solid block and a person was looking at it and you see their eye out the other side it's really freaky.
Tyson,it's a future of stealth what are you thoughts on digital privacy what do you mean well like phones here like phones like you ever talk to someone about something and then you see it on your Google feed you see ads yeah so we don't I mean I haven't researched this but my wife tell her we were once gifted one of these you know what do you call those things that you talk to oh yeah whatever the Google one is is that Alexa was home Google at home no Alexis is Amazon price so it's Google at home and she said don't turn that on I said why not because they'll be listening and I didn't believe her at first and then I started hearing stories and so so I don't have one but it's not coz I know that it's listening or not well yeah substantiated there's being actual setup they've apologized for actual human contractors listening into conversations that people have had.
Interviewer,having sex having arguments like it's real yeah that seems like it should be a problem so what's your question to me what am I well for it or my old one well what's your question no my question is one of the things that you're getting out of their ability to scan things is there tailoring things to your liking like you know your phone tells you it's 22 minutes until you get home I get it and I'm like bitch how do you know where I live exactly I didn't tell you where I live I got here it is and I'm just old-fashioned about this okay I'm get off my lawn about this yeah I'm the old man in a rocking chair on the porch saying goodbye Sonny get off my lawn but you're also scientist okay but I don't want to okay I wear multiple hats I'm also Dad I'm also a husband I got all these hats for all those things in this particular case I'm old man and my old man sensibility is.
Tyson,if you track what I shop at a store what I buy in a store.
Interviewer,and then send me coupons based on what you think I'm going to buy next based on what I've bought before which is kind of the same thing you're describing you have denied me the chance of stumbling upon something that I never thought of buying.
Tyson,and that takes away my freedoms and I don't want that how they denied you the chance of stumbling upon something different it's not diabolical it's just in the Casual flow of Life I'll give an example I walk into a wine shop is it can I help you.
Interviewer,and I say.
Tyson,if you help me find what I'm looking for it's a guarantee that I will never find what I'm not looking for.
Interviewer,and I'll end up spending less money in your wine shop.
Tyson,that's a weird way I look it's the art of browsing dude you're old enough to remember when I got to look up this word in a dictionary and you get through six other words oh I never knew that we're let me read that you learn other words en route to the word you're targeting I understand okay wouldn't that that is how I feel and that's how I think about my interaction with this world I'd like the randomness the randomness of it enriches my life and if you're going to advertise to me because you think you know who I am maybe you do.
Interviewer,But ultimately end up spending less money because it's the diversity of how I think and what I buy and what I think of buying and how I buy it and how much money I spend that is the richness of the life I lead you're trying to channel me into some product something that fulfills a what do you call it when they have the study whether you're going to buy something or not the survey that no no the the table of people do you like this product or not focus group am I just a focus group to you if I am you don't know me.
Tyson,and I want to experience this world by stepping where I've never stepped before and buying something I've never thought of buying and if you know my previous habits you're assuming I'm going to stay that way for the rest of my life and maybe most people do and maybe I might do that but if I do is because I chose to not because you have decided that that's how I should be well don't you think that just seem annoying I'm sorry are you getting a little excited sorry don't you think they're just doing that because they think it would be effective to advertising that way so if you go Googling new Nikes and then as you're looking at something in the Google ad pops up and it's for new Nikes I said hey Neil I know you were looking at these boys we sorry maybe I just need a little nudge I mean it's not I don't think that's that diabolical.
Interviewer,I'm the old man on the porch I'm saying the Next Generation might feel completely different steam I say I love it they know exactly what I want you heard about the case where they were the I read this I haven't read verified it but it's completely plausible it was a teenage girl who was Googling pregnancy tests because maybe she got pregnant okay and the fact that she had searched pregnancy test she got coupons in the mail for baby products.
Tyson,her parents had one of the wide what is this.
Interviewer,she got outed that's a little weird yeah but it's the kind of thing that can happen that seems that seems intrusive certainly the second pregnancy it's no in every way no be don't tell me it's not intrusive because you want to buy 90 being you physical things that's not just something that appears on your Google feed you can cook a glance over what's the difference between send you mail to your mailbox and filling your advertising space in front of your face with product with only one other people can see it I walk by your computer I can see it don't look yeah I guess I'm arguing in principle rather than in detail okay well let me take the CounterPoint in on the positive side what they're doing in terms of particularly Google in terms of you're driving right and in terms of using of Google Maps and documenting the history of all these.
Tyson,driving and especially with things like ways which they acquired is they've developed a much more efficient product than Apple which would Apple does the Apple Maps they shred everything you do this they do they did they all where you've been and where you're going that's correct but Apple Maps sucks so you have to because they don't have enough data they don't have nearly the amount of data Google has Billy what is Google giving you that Apple Maps isn't.
Interviewer,they're telling you you're 22 minutes from home you time for you to drive home what do you value in that well yes and also it's not a map wait hold on to their programs far better I can ask it how long it'll take me to go somewhere rather than it knowing what my what my daytime schedule looks like and then coming in like you said how do you know bitch you know I had that same reaction as you did and I said I wonder what's causing this it's a little creepy and again I'm the old man syndrome some ten-year-old kid that's only ever known this and becomes 15 and 20 that is life to them right why would they even maybe they're not going to complain about it but I'm the old man on the porch but do you know I'm saying get off my lawn sort of intrusiveness or at the very least this connection that you have to these devices and that they have to your patterns and your information is seems inevitable.
Tyson,that doesn't mean I have to welcome me with open arms but I agree it's inevitable I agree plus you have security cameras everywhere everybody knows where you are if the KGB had access to people the way we in the during the Cold War the way modern the United States has access to us.
Interviewer,we would say oh my gosh you have taken away your country's freedoms where the free leaders of the Free World and you guys have imprisoned your entire population oh my gosh.
Tyson,the KGB would give their right arm to have the monitoring devices that are actively in Pratt place here in the United States today mmm we know where you are we know how long you stayed there we have records of it we know what street you were walking on we don't necessarily moderate but we can dig it up if we have to and with facial recognition I can track you wherever you are I feel like there was just a facial recognition I use it now it doesn't have I'm wearing if I'm wearing a hat or sunglasses it still knows who the hell I am yeah.
