name,line
Cuban,"And not only is it very difficult, once you are public with Sarbanes-Oxley, but there's just no market, the investment bankers, there's, you know, I'm actually talking to people about starting an investment bank, geared towards small to medium-sized businesses, because I think there's an appetite for it from real investors, right? People who will buy shares in the open public markets and hold them and be shareholders, as opposed to, you know, high-volume traders, just looking to make, you know, basis points and flipping the stock, and billions of shares. And so, you're exactly right. There's this huge, huge, huge hole where nobody is investing in entrepreneurs."
Interviewer,And why do you think that is?
Cuban,"I just think the money is gravitated towards fast money. And, you know, I think the hole has been created, because investment banks, once they started going public, in particular, they just went to the biggest, you know, wherever they could find the biggest money. As much leverage as they can get as quick and as fast. Look, if I'm Goldman Sachs , and I have a whole quarter's worth of trading days where I don't lose a penny, I make money every single trading day, would I rather do that, or take the next Broadcast.com public? Or any small company public? Would I rather spend the money on going out there, and evaluating companies?"
Interviewer,"So let's say on banks, instead of 30-to-one, you're now restricted like a real bank, 11-to-one, 12-to-one. You have a stable dollar, so you don't get the juice of stability of trading in commodities and currencies."
Cuban,Uh-huh.
Interviewer,"You lower tax rates, or give holidays for certain periods of time."
Cuban,Uh-huh.
Interviewer,"You think boutiques, like what you're talking about, can rise up and fill the void that the big ones have left out there?"
Cuban,"Yeah, because there's going to be guys like me."
Interviewer,"Like going against a big retailer, if you have a boutique, people will pay up for specialized services?"
Cuban,"Absolutely, positively. What's happening right now, Steve, and it's really just over the past 12 months, there's kind of a groundswell that's, I don't want to say underground, but it's not being covered by the mainstream media, of companies like one called Y Combinator, which is just a little angel funding, where it says, You know what? We're probably not going to invest more than $100,000 in you, it may only be $50,000, it may be $25,000. And you're going to give us some preset amount, 10% of your company, and we're going to help you grow."
Interviewer,So a version of micro-lending?
Cuban,"Yeah, only micro-VC, if you will, right? But now, these things are springing up everywhere. Myself, I posted a blog post called The Mark Cuban Stimulus Plan about a year ago, right? And I just started getting these great ideas out of the woodwork. I thought, I'm probably, I think, nine in the past 12 or so months, where I've invested $250,000 or less and just found these great companies. And you can do it now because the cost of technology, you know, even when I started Broadcast.com, just to get a basic PC was $3,000. Now an iPad or a PC or a laptop is $400, and has 10 times the power."
Interviewer,So give some of the things you invested in. I love the name Naked Pizza.
Cuban,"I'm not going to touch that. Naked Pizza's a perfect example. I posted The Mark Cuban Stimulus Plan, I got an e-mail, and they were, like, You know, when the Mavericks play the New Orleans Hornets, you've got to come try our pizza. We think you'll like it. And I did. It was, like, I got to eat a whole pizza that I loved for under 800 calories. And I'm, like, You just convinced me that the product's worth it, right? And so, the guys are, busted their butts, bust their butts, but they were, because they'd taken out some loans, because there were some other elements that they kind of got ahead of themselves, they needed a small infusion of capital."
Cuban,"So, I think I put in $65,000 in total and now, they've signed, you know, they've used that to kind of get their head above water, invest in their one store in New Orleans. They've signed franchising agreements, you know, across the country. I mean, they've got over $1 million in down payments towards new franchises because I put in $65,000. And, you know, we've got companies like that. Now, I need my list."
Interviewer,Wickler?
Cuban,"Yeah, we have Wickler, it's just a very simple company that any public auditoriums, or bars, restaurants, that have big crowds, they face an issue with the fire marshal. And you see, like, people standing with these little clickers."
Interviewer,"Right, right."
Cuban,"Out at the front door, which is ridiculous, right? It's, you know, you can't even do it. So Wickler has a system where it automates that whole process and then with password driven, it connects right to the fire marshal, just to say, Hey, we've got a big crowd, just so you don't freak out, and B, feel free to come in and take a look at our numbers, online, as opposed to you getting in your truck and driving out there and making a big stink. And we're also looking at another company to complement that, it's called Motion Lift, that has a camera that has some really cool software that identifies through heat and visuals, the difference between bodies and live people and other devices, right?"
Cuban,"So now, we'll integrate those two together, and they have their own crowd control software for security applications. And again, I think that's a $250,000 investment. And the list just goes on and on and on and on. That is what's driving, all these companies are hiring people. They're just small startups, no loans. That's where economic growth is going to come from, and the government's got no clue. No clue that's going on. And, you know, there will be a book written talking about the underground VC economy of 2010 and it's just exploding right now."
Interviewer,"So, in essence, it's like the '70s, terrible decade, but you had Southwest Airlines ."
Cuban,Yep.
Interviewer,"FedEx , Oracle, Apple, Microsoft, all of these things."
Cuban,"Absolutely. Yeah, and look, Oracle with Larry Ellison, Microsoft with Bill Gates starting in New Mexico out of his parents' house. You know, Michael Dell."
Cuban,"I remember when I was just out of college, driving down to see Michael Dell to buy computer components to help me with my startup business, Micro Solutions, and telling Michael Dell, I think you've got something here. You guys are doing a really good job. You know, it was just two kids, you know, and he wasn't even in his 20s, I was in my early 20s, just saying, you know, just busting their butt. And that's exactly what it is."
Interviewer,"So the takeaway is, if the government just stepped aside and, if there's a need, entrepreneurs like you are going to find a way to fill it."
Cuban,"No question. The hard part is, you know, they're so far in, or so far up our, you know, how do you get them out, right, and what's the progression?"
Interviewer,How do you shoot the elephant?
Cuban,"That's exactly right. How do you shoot the elephant? And, you know, I'm not smart enough to have."
Interviewer,Maybe I should say donkey.
Cuban,"Either way, both, how do you shoot both? How do you get that wild game out of the living room?"
Interviewer,"Yeah. Mark, thank you very much."
Cuban,"Thank you, Steve, I really enjoyed it. It was a great interview."
Interviewer,Good fun. You're terrific.
Cuban,It was a fun interview.
