name,line
Interviewer,What is the kind of idea that you really love?
Cuban,Something that's differentiated. Something that's unique. Something that can grow I think into something that's big. Those are my favorite.
Interviewer,What is the kind of idea that you really love?
Cuban,"Something that's differentiated, something that's unique, something that can grow, I think, into something that's big. Those are my favorites."
Interviewer,"What kind of thing over the years, if you feel yeah, that that talk the shows about?"
Cuban,SURFSET Fitness is a perfect example. So this company comes in and once the former and the other his girlfriend and he wanted away to workout and also learn how to surf out of New Hampshire. We're going to learn to surf in New Hampshire in the winter.
Interviewer,"Talking about left field, you're dancing?"
Cuban,That's far out of left field.
Interviewer,You know what?
Cuban,That's what they took to shut me down.
Interviewer,You know why I'd like watching you on that show because it made me feel better about my dance.
Cuban,"I can't believe. Hey, I just have my hip replaced."
Interviewer,You know? You want that.
Cuban,I had my hip replaced.
Interviewer,Jerry Springer was a lot worse than you.
Cuban,"Oh there's a lot, lot worse than me."
Interviewer,And I love Jerry but I have to discuss this with you.
Cuban,"So, right there is doing the waltz whenever it was. I just have my hip replaced and so I was like, Please stay on one piece, please stay on one piece. And then, I do this jump at the end and then I landed and I didn't fall apart. And I was fired up. So, it was a more of victory."
Interviewer,"Do you have even now, Mark, do you get, you know, those moments when you wake up in the morning, you know, late at night and some and an incredible idea comes to you?"
Cuban,Yeah. I hate it now. I hate it because I have so much going on that I don't have...
Interviewer,Giving the time.
Cuban,"Yeah. I don't have that piece of dinner. It really takes a special motivation just to say, I don't give a damn, I'm going for it right. And you can't see bearers. People always say, You're such a risk taker. I have to take a risk. You know, I do the preparation, I do the work, and then when you're prepared, you can bust through to any wall."
Interviewer,And you're a father?
Cuban,"Yeah, that's makes it all."
Interviewer,Let's take a break and talk about fatherhood.
Cuban,Sure.
Interviewer,I want to know what kind of dad you are. I suspect you're a smiling assassin.
Cuban,Yeah.
Interviewer,"Son, I fully support you, son, if you come first."
Cuban,Exactly.
Interviewer,"The right of passage in the Cuban family, taking Jakers to his very first baseball game, right Jake? Yeah, that's good. Take off your tongue."
Cuban,"I do, too. I do, too."
Interviewer,Let's make some think about money and why it doesn't involve entitlement.
Cuban,"And that, you know, my daughter came home not long ago and she said, Dad, I'm mad because one of my friends came up with a business idea before I did. And so, you got to help me come up with a business idea now. And she was all excited then. You know, like any 10-year old, she got off and heard she was distracted, so get back on it."
Interviewer,"I've avoided politics too much because I think it's it can be quite tedious and then as good as somebody like you, but on a widen note, leadership seems to be in a vague form of paralysis in Washington generally in the moment. When you look at as an American, what is the answer to get through all this?"
Cuban,"I think we're in a transitional time. I mean, in an arrow where social media has changed, how media in general, right. It used to be there are three networks and there were seven networks, and then as long as you communicated through them, you can reach everybody. Now, people don't read the newspaper. They don't all watch the same news show. They, you know, there's the old saying that, If it's important to me, it will find me."
Interviewer,"It struck me that probably most people in Washington when they heard, what's that being sold in $19,000 billion. What is that?"
Cuban,Right.
Interviewer,"And be how can that be worth that money? I guess you or other people going, that probably quite shaky..."
Cuban,Yeah. I mean it makes...
Interviewer,...right?
Cuban,"... perfect sense, right."
Interviewer,Right.
Cuban,"So in one hand, you have a..."
Interviewer,Because you're familiar with that medium and how it will work.
Cuban,"And I use the app, right. I mean, look, if you're going to keep up with what's happening in the world today, if you're going to try to be a leader, if you're going to try have any impact on society, business, politics, wherever it may be, if you're not keeping up with what's going on from a technical perspective, you lost because, you know, the world isn't going to be run by people who control metal anymore."
Interviewer,"Why not put one in else's Snapchat, clearly because all my kids love it and like I'll tell all my friends."
Cuban,"It's interesting. So Snapchat is becoming a little social network. You know, I had all my problems wit the SCC and everything and so, I'm gearing people towards the zero footprint life, whether it's my kids, my business associates."
Interviewer,Right. Exactly right.
Cuban,"You know, after the conversation, it's gone. And I think the same things happen with text. That's why I wrote Cyber Dust. That's why I think everybody's mode of communication is going to change. And WhatsApp, one, they get app example, Cyber Chats and other so, I mean, Snapchat, Cyber Dust, it's only going to happen more and more."
Interviewer,"Well when we come back, I'll talk to you about the future. You only got it. You got the brain full of this, kind of thing."
Cuban,"I got two of them. I have my Samsung Note 3 which I like because it's big. I type, I get a thousand e-mails a day so let's me respond. And then I've got my back up phone, the iPhone, which I like because there's just certain apps that are only on the iPhone like Cyber Dust right now. Cycloramic everywhere. So there's all kinds of cool stuff. You got to keep up with everything."
Interviewer,You're a Mac guy or a PC?
Cuban,"All of the above. I mean I try to learn everything. I've got a Windows Surface Tablet. I've got a Mac. I've got a PC. You know, whatever it is. If I'm going to stay ahead, you know, there's always some 12-year old trying to kick my ass."
Interviewer,Go for it.
Cuban,And I've got to stay ahead.
Interviewer,I do have 15-year old kid. He was kicking my ass on the show. He was brilliant. Smart guy. CUBAN
Cuban,"Sensors and personalized medicine. It's not even close. Right now, we put everything into Google and expect to respond. Those days are disappearing. There's going to be sensors on our skin. I've got companies I'm investing in that literally put a little patch on and it tracks from the moisture, from the perspiration, and from the heat, just all these different things that proactively tell."
Interviewer,Amazing.
Cuban,Yeah. It will be totally different.
Interviewer,"What should I do brag, Mark Cuban?"
Cuban,Yeah. Whatever.
Interviewer,It's been great to talk to you.
Cuban,Always fun.
Interviewer,"Your book, How to Win at the Sport of Business"
Cuban,Really enjoyed it.
Interviewer,"Mark Cuban, remarkable man. That's all for us tonight."
Cuban,"I do, too. I do, too."
Interviewer,Let's make some think about money and why it doesn't involve entitlement.
Cuban,"And that, you know, my daughter came home not long ago and she said, Dad, I'm mad because one of my friends came up with a business idea before I did. And so, you got to help me come up with a business idea now. And she was all excited then. You know, like any 10-year old, she got off and heard she was distracted, so get back on it."
Interviewer,"I've avoided politics too much because I think it's it can be quite tedious and then as good as somebody like you, but on a widen note, leadership seems to be in a vague form of paralysis in Washington generally in the moment. When you look at as an American, what is the answer to get through all this?"
Cuban,"I think we're in a transitional time. I mean, in an arrow where social media has changed, how media in general, right. It used to be there are three networks and there were seven networks, and then as long as you communicated through them, you can reach everybody. Now, people don't read the newspaper. They don't all watch the same news show. They, you know, there's the old saying that, If it's important to me, it will find me."
Interviewer,"It struck me that probably most people in Washington when they heard, what's that being sold in $19,000 billion. What is that?"
Cuban,Right.
Interviewer,"And be how can that be worth that money? I guess you or other people going, that probably quite shaky..."
Cuban,Yeah. I mean it makes...
Interviewer,...right?
Cuban,"... perfect sense, right."
Interviewer,Right.
Cuban,"So in one hand, you have a..."
Interviewer,Because you're familiar with that medium and how it will work.
Cuban,"And I use the app, right. I mean, look, if you're going to keep up with what's happening in the world today, if you're going to try to be a leader, if you're going to try have any impact on society, business, politics, wherever it may be, if you're not keeping up with what's going on from a technical perspective, you lost because, you know, the world isn't going to be run by people who control metal anymore."
Interviewer,"Why not put one in else's Snapchat, clearly because all my kids love it and like I'll tell all my friends."
Cuban,"It's interesting. So Snapchat is becoming a little social network. You know, I had all my problems wit the SCC and everything and so, I'm gearing people towards the zero footprint life, whether it's my kids, my business associates."
Interviewer,Right. Exactly right.
Cuban,"You know, after the conversation, it's gone. And I think the same things happen with text. That's why I wrote Cyber Dust. That's why I think everybody's mode of communication is going to change. And WhatsApp, one, they get app example, Cyber Chats and other so, I mean, Snapchat, Cyber Dust, it's only going to happen more and more."
Interviewer,"Well when we come back, I'll talk to you about the future. You only got it. You got the brain full of this, kind of thing."
Cuban,"I got two of them. I have my Samsung Note 3 which I like because it's big. I type, I get a thousand e-mails a day so let's me respond. And then I've got my back up phone, the iPhone, which I like because there's just certain apps that are only on the iPhone like Cyber Dust right now. Cycloramic everywhere. So there's all kinds of cool stuff. You got to keep up with everything."
Interviewer,You're a Mac guy or a PC?
Cuban,"All of the above. I mean I try to learn everything. I've got a Windows Surface Tablet. I've got a Mac. I've got a PC. You know, whatever it is. If I'm going to stay ahead, you know, there's always some 12-year old trying to kick my ass."
Interviewer,Go for it.
Cuban,And I've got to stay ahead.
Interviewer,I do have 15-year old kid. He was kicking my ass on the show. He was brilliant. Smart guy. CUBAN
Cuban,"Sensors and personalized medicine. It's not even close. Right now, we put everything into Google and expect to respond. Those days are disappearing. There's going to be sensors on our skin. I've got companies I'm investing in that literally put a little patch on and it tracks from the moisture, from the perspiration, and from the heat, just all these different things that proactively tell."
Interviewer,Amazing.
Cuban,Yeah. It will be totally different.
Interviewer,"What should I do brag, Mark Cuban?"
Cuban,Yeah. Whatever.
Interviewer,It's been great to talk to you.
Cuban,Always fun.
Interviewer,"Your book, How to Win at the Sport of Business"
Cuban,Really enjoyed it.
Interviewer,"Mark Cuban, remarkable man. That's all for us tonight."
Cuban,There you go (laughs).
Interviewer,"That's well said, Skip. This is the shark tank and we want to start by finding out what is your, you may have more than one, but what's your biggest issue with Skip?"
Cuban,"It's not just Skip. Its sportswriters and sports media in general, where everything is generalities, right? ""Excruciating pressure"", what the hell is that, right? You know, ""need leader""."
Interviewer,It was excruciating pressure....
Cuban,Meaning what?
Interviewer,"Meaning that you personally watched up close and personally what Lebron went through against your Dallas Mavericks, and was it not the biggest collapse of a superstar we've ever witnessed on a finals or championship stage?"
Cuban,"No, I mean first of all its a team game. Right? You guys like to talk in complete generalities where no one can question you, right? You don't ever use facts, you don't ever use substance."
Interviewer,I don't ever use facts? That's all I use on this show.
Cuban,"""Excruciating pressure""? ""Undeniable"" this, it's just all generalities."
Interviewer,There's never been a star under more pressure going into a finals or championship series or game than Lebron James is under after nine years and three league MVPs.
Cuban,"First of all, you have a presumption that people care what you say. They don't. When guys."
Interviewer,That's fine. That's your opinion.
Cuban,"No, no, I'm talking about media in general. When guys get ready to play and they're in the locker room, they're not thinking ok well what's written, what's going to be written, what's being said, I mean, they're getting prepared. And if you've got a good coach and you've got a good culture, then guys are ready to play no matter what,like you guys were just talking about, you know, ""Miami just wanted more last night,"" that is just such horse-you-know-what, right. It's not that Okalhoma City didn't want it more, I think Miami was better prepared to play the game than Oklahoma City in terms of adjustments and changes, and now if you want to talk about double-teams and how they were used and whtether they should have played zone, um, what defensive structure was in place, that's a valid conversation. But just saying ""they wanted it more,"" that's ridiculous."
Interviewer,Ok.
Cuban,"When you're Kevin Durant, or yo'ure, uh, Derek Fisher, and you're Russell Westbrook, etc, and you're at that close out game, there's nobody who wants it more. It's just a question of who executes better and then you decide why."
Interviewer,"Who played harder? in the last games. Miami did, every game.. Lebron played harder than Kevin Durant did four straight games."
Cuban,"That is the most ridiculous thing any sportswriter has ever said. Now, if you think when Kevin Durant walked off the court he thought, yeah, I didn't play quite hard enough, right? Now you can say he wasn't put in a position to succeed, you can say they didn't run the right plays, they didn't get the ball to him on the block enough. And if you were smart you'd come out and you'd have substance. You'd say you know what, this is how many plays they ran to him on the block. Here's how Miami defended it. Now you can also argue the Pat Riley way is always the same way, all the time. Miami played it the same way all the time, and then we can have a discussion about adjustments. like last year, did we play harder than the Heat, is that what you think it was?"
Interviewer,"No, I don't. I think Lebron disappeared, and shrank in crunch time of the fourth quarter. I can just show you the numbers of what he didn't do in every fourth quarter."
Cuban,Wo we get no credit for not putting him in a position to succeed. RIght. We played the Heat.
Interviewer,"He put himself in, all he did was stand out on the perimeter."
Cuban,Now how do you think we defended that? WHy do you think he was standing out there?
Interviewer,"Uh, uh, you didn't have to defend him."
Cuban,"Oh right, so no matter what we did, he was just going to stand there and do nothing?"
Interviewer,That's all I saw. That was a lot of it.
Cuban,"That's exactly right, ""that's all you saw.""."
Interviewer,Hope that Dwyane Wade saves the day for him.
Cuban,"You're exactly right. That's all you saw. You didn't look. Right? I mean, that's a complete insult to us, to say you know what, the adjustments that we made-."
Interviewer,What did you do to force him out there?
Cuban,"We had different, we had like six, seven different types of matchups in our zone, and we played man-to-man, and we had a variety of different switches, right? So we knew that ninety percent of the shots were going to come from the left-hand side, right. We knew that if you gave him room from the left, he was going to drive. We didn't have the ahtletes that oklahoma city did, so we had to plan differently-."
Interviewer,Sure-.
Cuban,"So we need to make sure we pushed him out, away, and that we gave him different looks every time he had the ball, because just making, just forcing him to make a decision, to think about what he had to do, taking the time to read, are we in a zone, what type of zone we in, how are we matching up, what kind of rotations are we in, making him think forced him to pass around the perimeter, which gave us a chance to adjust. Now they're smarter, they're a better team this year, they deserved to win this year, but you know, that's the way we played it. So it wasn't just Lebron. Lebron actually played it right more often than not. He made the right pass to the right guy, who didn't make the right play. And that's exactly what we wanted"
Interviewer,They had several Steve Kerrs.
Cuban,"They had everybody stepping up and they deserved every bit. You know, so you talk in generalities."
Interviewer,No I'm not.
Cuban,"Yeah, you are."
Interviewer,"You spewed out some generality about players don't care. Let me tell you for a fact, and you can verify this, Stephen A, Lebron James listened to what I said for about, what, eight years? Because that's all I heard. He said I was his Howard Cosell. (Cuban smiles). And this year for the first time to his credit, he tuned out all the noise, that's all we saw was, he's reading The Hunger Games trilogy before the games. He's meditating on the bench before the games. He tuned us out."
Cuban,This is a Skip Bayless special. Lebron lost last year because he was paying attention to Skip Bayless. Lebron won this year because he wasn't paying-.
Interviewer,No.
Cuban,That's what you just said. Did he not just say that? (laughs).
Interviewer,"Here's what he didn't do against you guys. He let you off the hook, because he didn't do what we saw him do for four straight games. He didn't drive through your zone, and slash it up and dish. He didn't post up at all. This was a new deal, this was a new post-up game we saw this year from Lebron. He shredded the Oklahoma City defense because he drove and he dished."
Cuban,Ok. What kind of defense-.
Interviewer,He wanted to be a pretty jump shooter against you guys and it played right into your hands because he's a below-average jump shooter from the perimeter.
Cuban,"Ok, Skip, so when he was on the post, what were the different defensive schemes that Oklahoma City ran last night?"
Interviewer,"They had, they used Sefolosha on him, they used Durant on him-."
Cuban,When he was in the post what were the different defensive schemes they used?
Interviewer,Ibaka was supposed to come hard.
Cuban,Was supposed to come hard?
Interviewer,"And he did not come hard, he let Lebron get to the rim repeatedly, and Perkins was nowhere to be seen."
Cuban,I just asked a simple question.
Interviewer,And I just told you.
Cuban,"No, you said ""so and so was supposed to... ,"" no they, they doubled from down, right, and they doubled, and they passed and they hit their shots, when they kept on doubling, they changed, right, because they passed it out and Mike Miller hit the open shot. But that's just one example."
Interviewer,Did he get in the lane against you guys last year? Not at all in the fourth quarter.
Cuban,"Why do you play a zone, Skip?"
Interviewer,"Well, again, I've seen him slash up any kind of defense, when he feels like it. He's a freight train! You just said you don't have the athletes that they have."
Cuban,"Right. And that's why we played more zone than possibly Oklahoma City did. Because we had smarter players that are not necessarily as athletic. But the thing about the Miami Heat, they play the Pat Riley way. RIght? They play the exact same way, all the time. And I thought this series was going to be about adjustments. Oklahoma City felt like they had to do it a certain way, you know, it just didn't work, right? But it certainly wasn't the way we played them. So if you want to sit here and discuss ... let me put it another way. Every team tracks everything these days. So in game, we have five guys tracking what happens in a pick and roll situations, what happens in a post-up situation with Lebron, what happens with Lebron's posting and we run this type of zone, that type of zone. So you know in game exactly what the percentages are going. And if you are paying attention, you know those things as well. Oklahoma City didn't seem to make the number of adjustments they needed to make."
Interviewer,I agree.
Cuban,"And if you go through and look at the stats that I'm sure they have, that's what surprised me."
Interviewer,"Well you can throw all those stats out the window because, as Doc Rivers always says, it's a make or miss league."
Cuban,Yep.
Interviewer,"You won the championship last year because Dirk started making shots like he's never made 'em before. He played as tall as he is. Seven feet tall. And Lebron and Dwyane Wade started missing shots, or whoever else you want to throw in the equation."
Cuban,"No, actually, actually, we put Dirk in a position to succeed because we knew what Miami was going to do. They didn't make a lot of adjustments, they kept on playing the Pat Riley way. That increased our confidence as the game went by, as the games went by, right? So when we got to game four and everything was still the same, we knew we were going to win."
Interviewer,Are you criticizing the Pat Riley way?
Cuban,"Last year I was, this year it was perfect."
Interviewer,What was different?
Cuban,Last year versus this year?
Interviewer,Yeah.
Cuban,"They made their shots, and I don't think that they were, there wasn't as many adjustments against them."
Interviewer,Right. That's where I was going. Your club made the adjustments throughout the series. How surprised were you that Oklahoma City did not.
Cuban,"You know, I don't want to say anything about Oklahoma City because it's not like they had all season to work on these things."
Interviewer,Right.
Cuban,"RIght? We had the advantage of a full season where we played in, in, um, Chicago preseason last year, we played a whole game in nothing but zone. Nothing but zone. Because we knew we were going to have to go to the zone as our way to mix things up. And if you look at the..offensive results against our zone, you'd see, it was good. This year, because we had new guys, we didn't have as much time to practice, Okla-Indiana, same thing, why didn't they play zone? You don't have time to practice zone in a lockout shortened season when you don't practice. And I'm sure Oklahoma City faced the same thing. It's nice to say they could put in a zone, but if you don't have time to work on it, they can't. And I think that gave Miami a huge advantage."
Interviewer,So bottom line
Cuban,"I think we did a great job of taking him out of the game. Maybe he could have done more, but I think he played a Magic Johnson game last year against us and he needed other guys to step up and they didn't."
Interviewer,"Of all the things that have been said, I take issue with just one thing the great Mark Cuban had to say. I'll address that in a second though. I know we've got to go to break."
Cuban,"Yeah, I'm not going to play around with Lamar but let's put it this way. If a guy can't be part of our culture, you get rid of him."
Interviewer,"No, no, no, no. I'm not asking that question... I wasn't even asking, I respect the intricacies of that. What I am saying to you is that everybody and their grandmother could see that Lamar Odom didn't want it."
Cuban,"But we're not talking about a game in the middle of the season, right?"
Interviewer,"But I'm not talking about a game in the middle of the season, I'm talking about from the time that man got traded to Dallas he was miserable because he wanted to be in LA. What I'm saying is you can tell the difference. In other words-."
Cuban,I get your point. I get your point.
Interviewer,That's all I'm saying.
Cuban,"But you're in a close-out situation of the finals, right?"
Interviewer,Right.
Cuban,"And by the time you get to that point..the guys you put in, it's not like they were running the same rotation, both teams shortened their rotation. So the guys who are in the game, are the guys who are committed to play. Now if there's a guy that you don't think is in to it, or you don't think deserves to play, you're not going to play him."
Interviewer,"But there are times, and I agree with your assessment, what I'm saying is within the context of highly competitive competition, in terms of effort I totally agree with you. But what I'm saying is when you look at Lebron and you take into account all the suffering he has endured over the last several years, because of the expectations that weren't lived up to, because of the way he'd been maligned and ridiculed or what have you, if you're Kevin Durant, sure you're going out there and you're giving the same level of effort, but because you're seen and perceived as a relatively quiet, humble dude that everybody-."
Cuban,"It's a team game, so that comes down to are you putting your players offensively and defensively in a position to succeed. It's not a question of effort."
