name,line
Cuban,"Yeah, I don't mind having it attached to college, but I would make it an independent entity, so that it would operate independently. Look, if I wanted to create a League of Legends team, that's not N.C.A.A. bound, so I can pay players if I choose or incent them. I can let them have a job, right? Let them go get a job, let them practice as much as they need to. Much as I could if I wanted to create a band and I went to Indiana University, my alma mater, and foun, which has a great music school, and found the best musicians for the band I want to put together, I can pay them and they can stay in school. They can practice together as much as they want. That's the hypocrisy. If you want to be a professional athlete, you can't practice your craft as much as you would like. There's limits to coaching and playing with your teammates. There's limits on jobs you can take. There's there's so many different things that are bound in stone that it just doesn't make sense. And so there's reasons why they evolved to where they are, but it's time to take a whole different look."
Interviewer,Yeah. Do you know Domonique Foxworth?
Cuban,"No, I do not."
Interviewer,"He was the number two of the N.B.A. Players Association for a while. He was the president of the N.F.L. Players Association. He was a player, he was a cornerback, played for I guess Denver, Atlanta, then Baltimore. So he's an interesting guy. A career cut short by injury, but he cashed out because he had insurance. And now he's kind of mid-life, early 30s, and he's looking back and trying to figure out how to help the next generation of athlete do better. He told us that he thinks it would be in the best interest of players to dissolve the unions, the N.F.L.P.A., the N.B.A. Players Association, because that would put the leagues in violation of labor laws, and it would give players the power to negotiate better deals and to make more money."
Cuban,"Every time there's a lock, Look I'm not a C.B.A. expert, I can't get into details. The N.F.L., there's a long history of labor unrest and the first thing they do is dissolve the union."
Interviewer,"Well, let's say that for a minute you're not on the ownership side at all and that you're either with you, let's say you run the biggest sports agency in the country, or maybe are associated with players in some way."
Cuban,"Let me slow you down right there because if I do anything relative to the C.B.A., I'll get fined again. And while I like you, it's not strategic right now."
Interviewer,"Basically you like me fine but not as much as Dr. J is what you're saying, but that's alright, I can."
Cuban,Exactly.
Interviewer,I can accept that.
Cuban,Appreciate that.
Interviewer,Let me ask you this
Cuban,"Yeah I think it'll lead to our franchise valuations doubling, literally, because there's a lot more reasons for people to pay attention, a lot more reasons for people to watch. And that's good for our bottom line. People will attend more and watch more hours of N.B.A. basketball. And same for all professional sports."
Interviewer,"All right, I got a quiz for you, or a riddle. I know you're a very smart guy, I won't be surprised if you get this right. Home field advantage exists in every sport all over the world. What would you say is the primary driver of home-field advantage according to academics who've studied this?"
Cuban,"My guess would, and it's not home-court, home-ice advantage doesn't necessarily hold true. Like in hockey, it doesn't hold true. So, I would tell you probably the energy and, so there's a couple of things. One, I know there are studies that say that the officials give benefit to home teams across all sports. People have tried to argue that that's not the case. Whatever it is, it is. And then there's the energy of a crowd. I mean, crowds do make players play harder. And then I'd also say there's just the comfort of playing in a place that you're used to shooting and playing in, hitting in, fielding in, et cetera."
Interviewer,"So what the academics argue is that it's basically unconscious ref bias. That they're not rooting for the home team, obviously, but that basically the crowd's sentiment puts the refs unconsciously in that moment."
Cuban,I think Justin Wolfers wrote that.
Interviewer,Justin wrote about race actually. Most of the studies about home field advantage come from soccer where there are some nice little instrumental variables that you can use to determine.
Cuban,"And plus, depending on the level of soccer, where you're playing, Yeah there's concern for their lives."
Interviewer,"Yeah, exactly. Exactly. Yeah like one of the best pieces of evidence came from measuring soccer played in stadiums where there was a running track around the field. So the refs are literally 20 yards further from the crowd, and there the home field advantage is much less so. But that said, you are probably most famous, as an owner, for, I don't know if you want to call it working the refs, but communicating with the refs. Just talk about that, how it evolved and how successful you think it is."
Cuban,"It's funny. Everybody's wired differently and when I play basketball, and by the way I just got done playing basketball and I've just had a Diet Coke up against my Achilles. So, I've been a basketball junkie my entire life. Everybody's got something and for whatever reason when I got to the Mavs, I just looked at the officiating, and it just drove me nuts because my attitude has always been that the three officials in basketball, no matter what the level, have more impact than 80 percent of the players on the court. And that's why it's always driven me crazy. And when I first got in and started doing my homework, one of the things that was conventional wisdom is that games weren't officiated the same in the first minute as they were in the last minute, and that just drove me nuts. And the more I got to know, the more I got to learn. Then I started to understand how officials at all levels manage games and deal with certain issues. And it wasn't always about making the right call throughout the game. And so that just ticked me off. And that just led to everything else. And so was it worth it? Yeah, I think it has been, because I can tell you that things have changed dramatically. At various times they've changed dramatically for the better. At various times personnel changed and it got worse. So we'll see what happens this season."
Interviewer,Do you think that your input on that has changed the way N.B.A. games are refereed now? At least more consistency?
Cuban,"I don't know if there's more consistency, but yeah."
Interviewer,"What are the channels by which it's worked? Have there been actual committees where you sit down and say, listen this is plainly going on and it's not right, not fair, not transparent?"
Cuban,"No, it's not even like that. It's not like I come in and say this ref is biased or this guy's got a problem. Couple of times I've done that, and it's been investigated and it's been fixed. And it's not like Tim Donaghy, it's just little marginal things. But in any event, what has changed in m, The thing that I have always harped on the most is from all my experience in business, you always want to get the best possible manager. And where I've seen a lot of companies make mistakes is they'll take their best salesperson and make them a sales manager. Well, just cause you're a good salesperson doesn't make you a good sales manager. And so using that analogy, just because you were a good referee or just cause you were good in management somewhere in the N.B.A., doesn't mean you're the best person to be in charge of the officiating group. And that's been my biggest battle, that they promote people not because they were the best for the job but because they were there. Or they promoted refs into positions of authority, not because they were great managers or not because they could get great results, but because they used to be good refs, and those guys wanted to keep on working. And so that's where I had the greatest amount of problem and that's where I think I've had the greatest impact."
Interviewer,Gotcha. There's another piece of research that argues that a lot of N.B.A. coaches are bad strategically when it comes to sitting players in foul trouble. That if a player is good enough to sit because you're worried about losing him then is his value is actually greater by playing. I'm curious if you have any thoughts on that and if you've ever talked to your coaches about that.
Cuban,"No, I agree. Because, going back to the refs, even the refs know how many fouls a guy has. And so they understand that if it's a toss-up call and it's a gray area call, they're probably not going to call it. And players are smart enough to adjust. Now on the flip side when you know a great player has three fouls in the first quarter, you're going to go at him and try to get that fourth foul, because there is a point of diminishing returns. And so typically if it's two fouls, I'm fine if Rick keeps them in, and Rick's gotten to that point. If it's again a qualified depending on the opponent, right? Because the value of that player is relative to the time, the score, and the opponent. And so if the numbers say keep him in, I'm fine with keeping him in."
Interviewer,When are you finally going to buy a Major League Baseball team?
Cuban,Never.
Interviewer,What happened?
Cuban,"Never. Oh, well two things happened. One, they didn't want me in. And two I had, my kids got older and they're too much fun. 162 games, my wife would divorce me."
Interviewer,Why didn't baseball want you in?
Cuban,"Because they knew I'd try to change things. I just did an interview with C.C. Sabathia and he was like ""What would you do differently?"" One I would teach all our guys to bat flip, every time they hit a home run, because you got to just change things up. These unwritten rules are ridiculous and the fans pay the bills, you gotta give them a reason to come. Two, I'd push for the designated hitter in both leagues so that pitchers in between innings can go right to the bullpen and warm up or do whatever they needed to. And that way when you come back on the field, you don't throw any warmup pitches, you go right into pitching and there's no throwing the ball around the infield and the outfield. You just go right in. The breaks aren't the breaks, and you go right up to bat and you reduce an hour off the game."
Interviewer,It is pretty weird. It would be like in the N.B.A. between every dead ball there's like lay up practice again.
Cuban,"Yeah, exactly you get to get shots up and everything to get your rhythm. And so there's so many ways you can speed up the game. And I would have been pushing for them and talking about them and they didn't want to see that."
Interviewer,Yeah. What would you say have been your most significant changes to the way basketball is played since you've owned the team?
Cuban,"Oh, little things. Things like the Clear Path Rule. I changed it because I showed them the math was wrong. That it used to be one shot and the ball, I changed it to two shots and the ball. Different replay things. Now, with the latest collective bargaining agreement, there's a thing called the cap-room exception. So it used to be when a team had cap room you just had your cap room. Now there's a $4.4 million exception that I pushed to get through in our collective bargaining agreement in 2011. And so that's been a big change, and I'm sure there's other things that's just what comes to the top of my head."
Interviewer,The effect of that exception is what then?
Cuban,"So, if the Mavericks have $25 million in cap room this year and we use that cap room to sign three players and fully use it, we still have one exception where we can sign one or more players for up to $4.4 million dollars. And the logic was you want to incent teams to have cap room and to try to improve their teams, and one way to improve the incentive was to create this cap room exception."
Interviewer,"Right. All right, last question. Where is LeBron going?"
Cuban,I don't know and I can't comment on other teams' players.
Interviewer,Dallas is not a team I've heard mentioned at all. Should they be?
Cuban,"Who knows. Who knows. Like I said, you'r, I'm not ready to get fined again."
Interviewer,Basically I'm no Dr. J. I've learned my lesson I stand down.
Cuban,I would never say that.
Interviewer,"That said, I very much enjoyed it and I really appreciate your time and I wish you the best of luck this season."
Cuban,I appreciate it.
Interviewer,"Hey, you going to run for some office at some point?"
Cuban,"Yeah, I'm going to run to the bathroom right now. So I don't know, we'll see what happens in the midterms."
Interviewer,"But would you enjoy, do you think, the presidency would that be a job that, I mean just in the abstract, is it a job that you think."
Cuban,"Could I do the job? Yeah. Would I enjoy it, that's hard to say. The challenge isn't doing the job, it's the process to get there. The definition of poor parenting is having kids eight, 11, and 14 and running for the presidency."
Interviewer,"Yeah but just think how cute they'd be on the posters. I mean that's a real, I mean if you want to just talk pure strategic exploitation of your family that would be pretty."
Cuban,"No, I'm not a pimp. When it comes to my kids, no. It would be the exact opposite."
Interviewer,"All right, well whatever you do, I wish you continued huge success and I thank you very much for the time."
Cuban,Thanks I enjoyed the interview.
Interviewer,"Mark, good to have you with us."
Cuban,"Thanks for having me, Steve."
Interviewer,"You're in the media business, so let's ask a Shakespearean question. Whither media? One question, but you've been involved in so many aspects of it."
Cuban,"It's a great question. Everywhere. I mean, you obviously have lived and breathed the media your entire life. And, you know, as we've become more and more digital, we've evolved to expand from just beyond to Internet to mobile devices. And, you know, it's interesting, because we're have a Renaissance in computing power. Used to be, we got excited about what would happen on a desktop and that created video and other opportunities. We got excited about faster Internet. Now, with mobile devices of all sizes, from phones to iPads and other tablet type devices coming, you know, media isn't about picking up a newspaper at the airport or stopping at the newsstand. It's using whatever device you happen to have with whatever time you happen to have available to you to consume. And I think that's great for media, overall, because it means we're consuming so much more."
Interviewer,"You've made some observations about how, if something is free, be prepared to die."
Cuban,Yeah.
Interviewer,"And if you're No.1, be prepared to be upendedpreempted, as you put it."
Cuban,"Yes, sir."
Interviewer,Can you explain?
Cuban,"Sure. You know, there's a consciousness that goes with all technology. You know, there's again, going back in history, when I started working with PCs, there was those who used PCs and those were, you know, old-school, and paper-driven. But people paid for software. People paid for content. And then, over time, it evolved to once the Internet hit and the marginal cost of delivery of content in other items was free, because, you know, one more bit in your bandwidth pipe didn't really cost you anything, we started to see people give away content, in particular, for free and there were companies that were built on delivering whatever it is. It could be search results as content. It could be aggregating information, a la Drudge Report or some others. And they made their living based off of advertising around that content."
Interviewer,"YouTube, you think is something of a villain, in terms of live video on the Web, as you said, 10 years, what's to show for it?"
Cuban,"Well, no, it's not so much that they're a villain, I think they've created a misconception. Yeah, they are a villain, you know. In their own way, right, you know."
Interviewer,"You're an entrepreneur, you can get  with that."
Cuban,"I can get away with that, yeah. When you buy a market, right, there's some villainyI don't have the right word, right, but there's going to be a bad guy. And in YouTube's case, they, you know, I've always felt they stole content. You know, and Viacom feels the same way; they've sued them for it. But the, I think the bigger picture now, while they're litigating that in court, is that You Tube has subsidized the bandwidth of the Internet. You know, five years ago, if somebody would've said, Steve, we want to post this video online, the conversation then would've gone to, Well, how much is going to cost us? Where are we going to host it? Where are the servers going to come from? Now,  anybody who wants to post video online, it's presumed to be free."
Interviewer,"So, talking about Google, Google TV, and all of that, you've made the point, they're going into it."
Cuban,Uh-huh.
Interviewer,And you made the example of House.
Cuban,"Right. One of my favorite shows, right."
Interviewer,"And if Google puts up a kids thing, instead of what they perceive as a rival."
Cuban,"Right. Well, yeah, I mean, with Google Television, Google's kind of taken Microsoft's place as the dominant player in the current leading technology, if you will."
Interviewer,"Taking online. How, on advertising, how do you get real revenues from that, when you have networks, exchanges, where they try to commoditize everything?"
Cuban,"You don't. You really, really don't. I mean, it's the unwritten lie. You know, that, well, if I create a website, and I generate enough pageviews or have unique users, then I'll just be able to sell advertising. But the reality is, you know, there's unlimited inventory. Anybody can create it, so there has to be some value proposition, whether in the quality of the content or just sheer, absolute numbers that allow you to generate revenue."
Interviewer,"So, even if you have unique content, it's, in the old days are old days. A year ago."
Cuban,"Yeah, weeks ago, yeah."
Interviewer,You get a premium for it. You think the squeeze is going to be in the opposite direction?
Cuban,Yeah.
Interviewer,It's just pennies instead of dollars?
Cuban,"Yeah, no question. Just because great content is subjective, obviously. You know, you always hear people talk about the music business, which is the ultimate a la carte business."
Interviewer,"How do you get paid for content? Especially now, we consider, like, bread and butter, it's free."
Cuban,"Right, right, right, right. You know, there's an interesting lesson going on right now, with Facebook and Google. One of the most unique lessons of Facebook is that most of its stuff's not indexed in Google. And it's doing just fine. You know, 500 million unique users, yet you know, Google's, and I don't mean this to sound like, let's just, you know,  step-on-Google interview. But when they're."
Interviewer,Why not?
Cuban,"Yeah, why not, huh? But when they're the dominant player, I mean, just like we used to talk about Microsoft all the time."
Interviewer,Exactly.
Cuban,"But, you know, Google's stated intent is to index all the world's information."
Interviewer,Right.
Cuban,"Now they're, like the commercial says, There's an app for that. And that's information that Google no longer has access to. So how does that transition to media? Well, the fear always was if I'm not participating with Google, I'm not going to have access to all those people. That's disappearing. So between Facebook, who generates probably more usage outside of it than maybe even Google for a lot of scenarios, for a lot of content, Twitter, which generates a ton of content. I know my own blog, Twitter generates 90% of the referrals that I get. Google is just a de minimus amount. And so now we're starting to see that there are other sources. And, you know, we're starting to see a greater influx of real-time data being created by media sources as well."
Interviewer,"So it's not like Easy Pass, you know, pay 10 cents for this or pay 90 cents for another?"
Cuban,"Because, you know, if you're interested in good content, your time is of some level of value, in trying to determine whether it's worth it to pay a penny or not, just going through the process makes it not worth it. So, there's got to be an, that's why Amazon is so dominant. Your credit card's already there. It's easier just to, I mean, I'm spoiled, I'll order shampoo and shaving cream and everything, and it'll just show up because it's just easier than getting in the car and doing whatever."
Interviewer,"Sort of like cable, you do it once a month, and that's it."
Cuban,"And it's there, yeah. And it's simple, exactly. Great analogy. And I think newspapers have got to put themselves in the same position. That's kind of the chicken and egg right now. I don't think the difficulty's going to be getting people to pay. I think it's in how you get them to pay. And it may well be that like the cable analogy, where it's already bundled, and you pay one bill, and you know, it's cheaper than if you had to do a la carte."
Interviewer,"So instead of maybe a site, you have an app?"
Cuban,"Well, an app is going to be one part of it, but you've got to get people to use the app. But I think you might even glom on to what other people are doing. So, you might say, Amazon, what are you selling? Netflix , would you like to include newspapers as part of it? You know, for an extra $1.00, you get access to these 15 newspapers, then we just pay back the newspapers per turn, just like Netflix does with movies. And so, you go where the credit cards already are. You go where the perceived value is greater than the incremental."
Interviewer,"So it's not content, it's marketing."
Cuban,"It's both, right? But I think you've got to get there, but it's got to be easy. It's got to be the path of least resistance."
Interviewer,"And, so, just to be philosophical for one second, what you see unfolding against the monster Google as the alternatives are coming?"
Cuban,They're here.
Interviewer,They're breaking them up.
Cuban,"Right. And it's really a question of how to package and market, and make it so that it's the path of least resistance. Because Google has always been so fast and so easy, it was the path of least resistance to get to news."
Interviewer,Path of least resistance.
Cuban,That's the difference.
Interviewer,"And you keep emphasizing with things like Facebook or Twitter, enjoy your dominance,  other things are coming along."
Cuban,"No question. You know, we're, mobile is changing everything. You know, we're in a boring stage of the Internet, if you will, where it's a utility. Ten years ago it wasn't a utility. If you put together an application on the Web, there's a very good chance it was going to break. And, you know, five years ago, if you started, you know, when, look at Twitter, it still breaks sometimes."
Interviewer,So it's not going to go the way of wire lines?
Cuban,"No, it's not going to go the way of lines, but there's a lot of change. I guess the bigger point is, the philosophical side is, the rules are going to be rewritten again because of how we integrate mobile devices into our lives. Not just outside the home, like we use them today, but inside the home as well."
Interviewer,Where's that leave cable?
Cuban,"I think cable's in a good spot, right? Because they're the better packages of television, which I don't think goes away. One of the driving forces that I think people miss all the time is big-screen televisions are the No. 1 consumer device. You know, when I started HDNET in 2001, a 40 inch, you know, plasma that was, you know,  wasn't even 720p, was $12,000."
Interviewer,Right.
Cuban,"Now, on the way over here, I'm reading on, you know, in the back page of one of the newspapers that you can get a 40 inch television for $398, and a 32 inch all hi-def, HDMI, all the fanciest of the fancy, right?"
Interviewer,Wow. You're a great entrepreneur.
Cuban,I try.
Interviewer,"Well, the economy."
Cuban,Uh-huh.
Interviewer,"Washington doesn't seem to recognize, if you don't have entrepreneurs, you don't get innovation ."
Cuban,"Well, I mean, you obviously know, you have been talking about that better than anybody."
Interviewer,"So what's the most alarming trend you see right now, and do you see correctives coming along?"
Cuban,"Well, the most alarming trend is that Congress thinks they know what they're doing, when everybody knows that they don't. And you get a bastardized solution, as a result. And you know, the more pages in the bill past probably 100, the more the law of unintended consequences is waiting, just to kick everybody in the butt, and the whole economy."
Interviewer,Sort of a perverse Moore's Law.
Cuban,"That's exactly right. It's a very perverse Moore's Law. And so, I've always been of the mindset that the American spirit is what sets our country apart from every other country in the world. You know, we're just raised that there's a unique opportunity for any one of us should we decide to take advantage."
Interviewer,The idea of taxing so-called carried interest.
Cuban,Right.
Interviewer,Not a good idea.
Cuban,"Actually, I'm going to disagree with you. I like the idea of carried tax and carried interest because I like to say short-term, but there is no such thing as a short-term tax, right?"
Interviewer,"So, if you own the U.S. government, like you own the Mavericks, what would you do to unleash the entrepreneur?"
Cuban,"I would do a couple things. One, I would say that any equity investment in a company with 25 or fewer employees, held for, pick a term, three years or five years, when you sell it, it's tax-free."
Interviewer,Reduce the capital gains.
